Cites,Authors,Title,Year,Source,Publisher,ArticleURL,CitesURL,GSRank,QueryDate,Type,DOI,ISSN,CitationURL,Volume,Issue,StartPage,EndPage,ECC,CitesPerYear,CitesPerAuthor,AuthorCount,Age,Abstract
7653,"C Wohlin, P Runeson, M Höst, MC Ohlsson, B Regnell…","Experimentation in software engineering",2012,"","books.google.com","https://books.google.com/books?hl=en&lr=&id=QPVsM1_U8nkC&oi=fnd&pg=PR5&dq=software+engineering&ots=GPv0u9oOuq&sig=0pIZTPZ-jAw7ju79GBwyjcWqtZ8","https://scholar.google.com/scholar?cites=1197525888986143580&as_sdt=2005&sciodt=0,5&hl=en",1,"2021-05-11 13:03:30","BOOK","","","",,,,,7653,850.33,1276,6,9,"Like other sciences and engineering disciplines, software engineering requires a cycle of model building, experimentation, and learning. Experiments are valuable tools for all software engineers who are involved in evaluating and choosing between different methods …"
441,"R Mall","Fundamentals of software engineering",2018,"","books.google.com","https://books.google.com/books?hl=en&lr=&id=-JNuDwAAQBAJ&oi=fnd&pg=PP1&dq=software+engineering&ots=PAHe4PZcjd&sig=GvsIdIScEF1dOERiD1vMsQ2zOPA","https://scholar.google.com/scholar?cites=227629719296600558&as_sdt=2005&sciodt=0,5&hl=en",2,"2021-05-11 13:03:30","BOOK","","","",,,,,441,147.00,441,1,3,"This new edition of the book, is restructured to trace the advancements made and landmarks achieved in software engineering. The text not only incorporates latest and enhanced software engineering techniques and practices, but also shows how these techniques are …"
698,"P Jalote","An integrated approach to software engineering",2012,"","books.google.com","https://books.google.com/books?hl=en&lr=&id=Hi_vBwAAQBAJ&oi=fnd&pg=PR5&dq=software+engineering&ots=VWLvhxulYJ&sig=eZsK0uH-EPbHyg2vC6syBMt143c","https://scholar.google.com/scholar?cites=6550574024585104955&as_sdt=2005&sciodt=0,5&hl=en",3,"2021-05-11 13:03:30","BOOK","","","",,,,,698,77.56,698,1,9,"A lot has changed in the fast-moving area of software engineering since the first edition of this book came out. However, two particularly dominant trends are clearly discernible: focus on software processes and object-orientation. A lot more attention is now given to software …"
1051,"N Juristo, AM Moreno","Basics of software engineering experimentation",2013,"","books.google.com","https://books.google.com/books?hl=en&lr=&id=iJTkBwAAQBAJ&oi=fnd&pg=PR11&dq=software+engineering&ots=VQQ7xEFBTW&sig=PbDhtP4cvaYNVXXOno3nggAr044","https://scholar.google.com/scholar?cites=8186766832137197910&as_sdt=2005&sciodt=0,5&hl=en",4,"2021-05-11 13:03:30","BOOK","","","",,,,,1051,131.38,526,2,8,"Basics of Software Engineering Experimentation is a practical guide to experimentation in a field which has long been underpinned by suppositions, assumptions, speculations and beliefs. It demonstrates to software engineers how Experimental Design and Analysis can …"
491,"NMA Munassar, A Govardhan","A comparison between five models of software engineering",2010,"International Journal of Computer Science …","Citeseer","http://citeseerx.ist.psu.edu/viewdoc/download?doi=10.1.1.402.8120&rep=rep1&type=pdf#page=115","https://scholar.google.com/scholar?cites=7084013563358304757&as_sdt=2005&sciodt=0,5&hl=en",5,"2021-05-11 13:03:30","PDF","","","",,,,,491,44.64,246,2,11,"This research deals with a vital and important issue in computer world. It is concerned with the software management processes that examine the area of software development through the development models, which are known as software development life cycle. It …"
118,"R Stephens","Beginning software engineering",2015,"","books.google.com","https://books.google.com/books?hl=en&lr=&id=SyHWBgAAQBAJ&oi=fnd&pg=PP1&dq=software+engineering&ots=3XlYYb8VNM&sig=rry2IImKywg5jB_bczXOuhfikh4","https://scholar.google.com/scholar?cites=18332103045666612272&as_sdt=2005&sciodt=0,5&hl=en",6,"2021-05-11 13:03:30","BOOK","","","",,,,,118,19.67,118,1,6,"A complete introduction to building robust and reliable software Beginning Software Engineering demystifies the software engineering methodologies and techniques that professional developers use to design and build robust, efficient, and consistently reliable …"
103,"A Noureddine, A Bourdon, R Rouvoy…","A preliminary study of the impact of software engineering on greenit",2012,"… Sustainable Software …","ieeexplore.ieee.org","https://ieeexplore.ieee.org/abstract/document/6224251/","https://scholar.google.com/scholar?cites=7787505497553254867&as_sdt=2005&sciodt=0,5&hl=en",7,"2021-05-11 13:03:30","","","","",,,,,103,11.44,26,4,9,"GreenIT has emerged as a discipline concerned with the optimization of software solutions with regards to their energy consumption. In this domain, most of state-of-the-art solutions offer limited or constraining approaches to monitor the energy consumption of a device or a …"
502,"M Robillard, R Walker, T Zimmermann","Recommendation systems for software engineering",2009,"IEEE software","ieeexplore.ieee.org","https://ieeexplore.ieee.org/abstract/document/5235134/","https://scholar.google.com/scholar?cites=8072591084683138361&as_sdt=2005&sciodt=0,5&hl=en",8,"2021-05-11 13:03:30","","","","",,,,,502,41.83,167,3,12,"Software development can be challenging because of the large information spaces that developers must navigate. Without assistance, developers can become bogged down and spend a disproportionate amount of their time seeking information at the expense of other …"
615,"AJ Ko, R Abraham, L Beckwith, A Blackwell…","The state of the art in end-user software engineering",2011,"ACM Computing …","dl.acm.org","https://dl.acm.org/doi/abs/10.1145/1922649.1922658","https://scholar.google.com/scholar?cites=5556567274419057435&as_sdt=2005&sciodt=0,5&hl=en",9,"2021-05-11 13:03:30","","","","",,,,,615,61.50,123,5,10,"Most programs today are written not by professional software developers, but by people with expertise in other domains working towards goals for which they need computational support. For example, a teacher might write a grading spreadsheet to save time grading, or …"
1240,"M Brambilla, J Cabot, M Wimmer","Model-driven software engineering in practice",2017,"… on software engineering","morganclaypool.com","https://www.morganclaypool.com/doi/abs/10.2200/S00751ED2V01Y201701SWE004","https://scholar.google.com/scholar?cites=4796079812203773998&as_sdt=2005&sciodt=0,5&hl=en",10,"2021-05-11 13:03:30","","","","",,,,,1240,310.00,413,3,4,"This book discusses how model-based approaches can improve the daily practice of software professionals. This is known as Model-Driven Software Engineering (MDSE) or, simply, Model-Driven Engineering (MDE). MDSE practices have proved to increase …"
73,"L Briand","Embracing the engineering side of software engineering",2012,"IEEE software","ieeexplore.ieee.org","https://ieeexplore.ieee.org/abstract/document/6265086/","https://scholar.google.com/scholar?cites=14978100767254729046&as_sdt=2005&sciodt=0,5&hl=en",11,"2021-05-11 13:03:30","","","","",,,,,73,8.11,73,1,9,"The author provides, based on 20 years of research and industrial experience, his assessment of software engineering research. He then builds on such analysis to provide recommendations on how we need to change as a research community to increase our …"
81,"C Calero, M Piattini","Green in software engineering",2015,"","Springer","https://link.springer.com/content/pdf/10.1007/978-3-319-08581-4.pdf","https://scholar.google.com/scholar?cites=3720270112742402673&as_sdt=2005&sciodt=0,5&hl=en",12,"2021-05-11 13:03:30","BOOK","","","",,,,,81,13.50,41,2,6,"Sustainability is being demanded by our society today; we have become aware of the need to cut down on our energy consumption and reduce our carbon footprint. At an international level, there is a whole host of initiatives trying to tackle these issues, and the main research …"
87,"H Zhang, MA Babar","On searching relevant studies in software engineering",2010,"… and Assessment in Software Engineering …","scienceopen.com","https://www.scienceopen.com/hosted-document?doi=10.14236/ewic/EASE2010.14","https://scholar.google.com/scholar?cites=16527719284740017129&as_sdt=2005&sciodt=0,5&hl=en",13,"2021-05-11 13:03:30","","","","",,,,,87,7.91,44,2,11,"BACKGROUND: Systematic Literature Review (SLR) has become an important research methodology in software engineering since 2004. One critical step in applying this methodology is to design and execute appropriate and effective search strategy. This is …"
101,"B Vogel-Heuser, C Diedrich, A Fay, S Jeschke…","Challenges for software engineering in automation",2014,"… of Software Engineering …","scirp.org","https://www.scirp.org/html/11-9301880_46096.htm","https://scholar.google.com/scholar?cites=4031982210237805833&as_sdt=2005&sciodt=0,5&hl=en",14,"2021-05-11 13:03:30","HTML","","","",,,,,101,14.43,20,5,7,"This paper gives an introduction to the essential challenges of software engineering and requirements that software has to fulfill in the domain of automation. Besides, the functional characteristics, specific constraints and circumstances are considered for deriving …"
118,"C Page, HW Six","Software Engineering",2017,"Larsen and Keller Education","repo.mimitlibrary.ac.in","http://repo.mimitlibrary.ac.in:8080/jspui/bitstream/123456789/6319/1/Software%20Engineering%20BS-302.pdf","https://scholar.google.com/scholar?cites=15367625980789631441&as_sdt=2005&sciodt=0,5&hl=en",15,"2021-05-11 13:03:30","","","","",,,,,118,29.50,59,2,4,"1. a) What are drawbacks of Spiral Model? b) What is the role of Metrics? c) Write a short note on use case diagrams? d) Define Lattice Model? e) Write a short note on ER diagram? f) Explain software cost estimation in project planning? g) Distinguish between verification & …"
1338,"P Runeson, M Host, A Rainer, B Regnell","Case study research in software engineering: Guidelines and examples",2012,"","books.google.com","https://books.google.com/books?hl=en&lr=&id=T7rXoaxqPIAC&oi=fnd&pg=PT8&dq=software+engineering&ots=bcylxdJ8sH&sig=ziN5KYZKk272gGeq7AVPrW6dWpg","https://scholar.google.com/scholar?cites=15312839158858777236&as_sdt=2005&sciodt=0,5&hl=en",16,"2021-05-11 13:03:30","BOOK","","","",,,,,1338,148.67,335,4,9,"Based on their own experiences of in-depth case studies of software projects in international corporations, in this book the authors present detailed practical guidelines on the preparation, conduct, design and reporting of case studies of software engineering. This is …"
729,"AI Wasserman","Software engineering issues for mobile application development",2010,"… FSE/SDP workshop on Future of software engineering …","dl.acm.org","https://dl.acm.org/doi/abs/10.1145/1882362.1882443","https://scholar.google.com/scholar?cites=4940300216470751651&as_sdt=2005&sciodt=0,5&hl=en",17,"2021-05-11 13:03:30","","","","",,,,,729,66.27,729,1,11,"This paper provides an overview of important software engineering research issues related to the development of applications that run on mobile devices. Among the topics are development processes, tools, user interface design, application portability, quality, and …"
1181,"B Bruegge, AH Dutoit","Object-‐Oriented Software Engineering. Using UML, Patterns, and Java",2009,"Learning","cobweb.cs.uga.edu","http://cobweb.cs.uga.edu/students/syllabi_pdf/CIS_CSCI_4050.pdf","https://scholar.google.com/scholar?cites=17769714450124499357&as_sdt=2005&sciodt=0,5&hl=en",18,"2021-05-11 13:03:30","PDF","","","",,,,,1181,98.42,591,2,12,"Full cycle of a software system development effort, including requirements definition, system analysis, design, implementation, and testing. Special emphasis is placed on system analysis and design. The design phase includes development of a user interface. A large …"
83,"PA Darnell, PE Margolis","CA Software Engineering Approach",2012,"","books.google.com","https://books.google.com/books?hl=en&lr=&id=fLcPBwAAQBAJ&oi=fnd&pg=PR9&dq=software+engineering&ots=D7Dj-kDiGy&sig=h2OqYO5l9i4A2qfvFj0FY8EfHJ0","https://scholar.google.com/scholar?cites=6000037910025703331&as_sdt=2005&sciodt=0,5&hl=en",19,"2021-05-11 13:03:30","BOOK","","","",,,,,83,9.22,42,2,9,"to Software Engineering For'tis the sport to have the engineer Hoist with his own petar. Shakespeare, Hamlet In the previous chapter, we introduced same basic information about pro gramming and programming languages, particularly C. If this were a book about building …"
40,"I Jacobson, E Seidewitz","A new software engineering",2014,"Communications of the ACM","dl.acm.org","https://dl.acm.org/doi/fullHtml/10.1145/2677034","https://scholar.google.com/scholar?cites=11364895964135352608&as_sdt=2005&sciodt=0,5&hl=en",20,"2021-05-11 13:03:30","","","","",,,,,40,5.71,20,2,7,"WHAT HAPPENED TO software engineering? What happened to the promise of rigorous, disciplined, professional practices for software development, like those observed in other engineering disciplines? What has been adopted under the rubric of “software engineering” is a set of practices …"
70,"H Sharp, Y Dittrich…","The role of ethnographic studies in empirical software engineering",2016,"… on Software Engineering","ieeexplore.ieee.org","https://ieeexplore.ieee.org/abstract/document/7387744/","https://scholar.google.com/scholar?cites=11559910527547888538&as_sdt=2005&sciodt=0,5&hl=en",21,"2021-05-11 13:03:30","","","","",,,,,70,14.00,23,3,5,"Ethnography is a qualitative research method used to study people and cultures. It is largely adopted in disciplines outside software engineering, including different areas of computer science. Ethnography can provide an in-depth understanding of the socio-technological …"
97,"O Marbán, J Segovia, E Menasalvas…","Toward data mining engineering: A software engineering approach",2009,"Information systems","Elsevier","https://www.sciencedirect.com/science/article/pii/S0306437908000355","https://scholar.google.com/scholar?cites=12274288508921336941&as_sdt=2005&sciodt=0,5&hl=en",22,"2021-05-11 13:03:30","","","","",,,,,97,8.08,24,4,12,"The number, variety and complexity of projects involving data mining or knowledge discovery in databases activities have increased just lately at such a pace that aspects related to their development process need to be standardized for results to be integrated …"
93,"M Harman","The role of artificial intelligence in software engineering",2012,"… on Realizing AI Synergies in Software Engineering …","ieeexplore.ieee.org","https://ieeexplore.ieee.org/abstract/document/6227961/","https://scholar.google.com/scholar?cites=38506826621146649&as_sdt=2005&sciodt=0,5&hl=en",23,"2021-05-11 13:03:30","","","","",,,,,93,10.33,93,1,9,"There has been a recent surge in interest in the application of Artificial Intelligence (AI) techniques to Software Engineering (SE) problems. The work is typified by recent advances in Search Based Software Engineering, but also by long established work in Probabilistic …"
78,"B Penzenstadler","Towards a definition of sustainability in and for software engineering",2013,"Proceedings of the 28th Annual ACM Symposium on …","dl.acm.org","https://dl.acm.org/doi/abs/10.1145/2480362.2480585","https://scholar.google.com/scholar?cites=17897930970224995369&as_sdt=2005&sciodt=0,5&hl=en",24,"2021-05-11 13:03:30","","","","",,,,,78,9.75,78,1,8,"Sustainability is not supported by traditional software engineering methods. This lack of support leads to inefficient efforts to address sustainability or complete omission of this important concept. Defining and developing adequate support requires a commonly …"
3298,"L Chung, BA Nixon, E Yu, J Mylopoulos","Non-functional requirements in software engineering",2012,"","books.google.com","https://books.google.com/books?hl=en&lr=&id=MNrcBwAAQBAJ&oi=fnd&pg=PR15&dq=software+engineering&ots=g2FcI4vT7O&sig=L0eatLaDs0s6n9Ccu_cB22wimRk","https://scholar.google.com/scholar?cites=7551642071620688669&as_sdt=2005&sciodt=0,5&hl=en",25,"2021-05-11 13:03:30","BOOK","","","",,,,,3298,366.44,825,4,9,"Non-Functional Requirements in Software Engineering presents a systematic and pragmatic approach tobuilding quality into'software systems. Systems must exhibit software quality attributes, such as accuracy, performance, security and modifiability. However, such non …"
75,"M Broy, E Denert","Software pioneers: contributions to software engineering",2012,"","books.google.com","https://books.google.com/books?hl=en&lr=&id=Sr-qCAAAQBAJ&oi=fnd&pg=PA11&dq=software+engineering&ots=H4Y0Zji9Hv&sig=Tj5MTAgpnYraRyao_tsiM6L94dY","https://scholar.google.com/scholar?cites=8634854662376839007&as_sdt=2005&sciodt=0,5&hl=en",26,"2021-05-11 13:03:30","BOOK","","","",,,,,75,8.33,38,2,9,"A lucid statement of the philosophy of modular programming can be found in a 1970 textbook on the design of system programs by Gouthier and Pont [1, l Cfl0. 23], which we quote below: A well-defined segmentation of the project effort ensures system modularity …"
86,"T DeMarco","Software engineering: An idea whose time has come and gone?",2009,"IEEE Software","search.proquest.com","https://search.proquest.com/openview/0d2416ea995c28534af7936314299b60/1?pq-origsite=gscholar&cbl=37787","https://scholar.google.com/scholar?cites=60320146549048055&as_sdt=2005&sciodt=0,5&hl=en",27,"2021-05-11 13:03:30","","","","",,,,,86,7.17,86,1,12,"Compelled to Control The book's most quoted line is its first sentence: “You can't control what you can't measure.” This line contains a real truth, but I've become increas- ingly uncomfortable with my use of it. Implicit in the quote (and indeed in the book's title) is that control is an important …"
77,"H Hoodat, H Rashidi","Classification and analysis of risks in software engineering",2009,"World Academy of Science, Engineering and …","Citeseer","http://citeseerx.ist.psu.edu/viewdoc/download?doi=10.1.1.193.3662&rep=rep1&type=pdf","https://scholar.google.com/scholar?cites=6521898481463538745&as_sdt=2005&sciodt=0,5&hl=en",28,"2021-05-11 13:03:30","PDF","","","",,,,,77,6.42,39,2,12,"Despite various methods that exist in software risk management, software projects have a high rate of failure. When complexity and size of the projects are increased, managing software development becomes more difficult. In these projects the need for more analysis …"
99,"D Falessi, N Juristo, C Wohlin, B Turhan…","Empirical software engineering experts on the use of students and professionals in experiments",2018,"… Software Engineering","Springer","https://link.springer.com/article/10.1007/s10664-017-9523-3","https://scholar.google.com/scholar?cites=15721662872684483389&as_sdt=2005&sciodt=0,5&hl=en",29,"2021-05-11 13:03:30","","","","",,,,,99,33.00,20,5,3,"Abstract [Context] Controlled experiments are an important empirical method to generate and validate theories. Many software engineering experiments are conducted with students. It is often claimed that the use of students as participants in experiments comes at the cost of …"
3990,"P Runeson, M Höst","Guidelines for conducting and reporting case study research in software engineering",2009,"Empirical software engineering","Springer","https://link.springer.com/article/10.1007/s10664-008-9102-8","https://scholar.google.com/scholar?cites=16127251919715312246&as_sdt=2005&sciodt=0,5&hl=en",30,"2021-05-11 13:03:30","HTML","","","",,,,,3990,332.50,1995,2,12,"Case study is a suitable research methodology for software engineering research since it studies contemporary phenomena in its natural context. However, the understanding of what constitutes a case study varies, and hence the quality of the resulting studies. This paper …"
536,"DS Cruzes, T Dyba","Recommended steps for thematic synthesis in software engineering",2011,"… on empirical software engineering and …","ieeexplore.ieee.org","https://ieeexplore.ieee.org/abstract/document/6092576/","https://scholar.google.com/scholar?cites=12246768285999463777&as_sdt=2005&sciodt=0,5&hl=en",31,"2021-05-11 13:03:30","","","","",,,,,536,53.60,268,2,10,"Thematic analysis is an approach that is often used for identifying, analyzing, and reporting patterns (themes) within data in primary qualitative research.'Thematic synthesis' draws on the principles of thematic analysis and identifies the recurring themes or issues from multiple …"
94,"HK Wright, M Kim, DE Perry","Validity concerns in software engineering research",2010,"… on Future of software engineering …","dl.acm.org","https://dl.acm.org/doi/abs/10.1145/1882362.1882446","https://scholar.google.com/scholar?cites=7298658071095822703&as_sdt=2005&sciodt=0,5&hl=en",32,"2021-05-11 13:03:30","","","","",,,,,94,8.55,31,3,11,"Empirical studies that use software repository artifacts have become popular in the last decade due to the ready availability of open source project archives. In this paper, we survey empirical studies in the last three years of ICSE and FSE proceedings, and categorize these …"
68,"C Calero, M Piattini","Introduction to green in software engineering",2015,"Green in Software Engineering","Springer","https://link.springer.com/chapter/10.1007/978-3-319-08581-4_1","https://scholar.google.com/scholar?cites=1748815609936043852&as_sdt=2005&sciodt=0,5&hl=en",33,"2021-05-11 13:03:30","","","","",,,,,68,11.33,34,2,6,"Sustainability is gaining importance worldwide, reinforced by several initiatives with wide media coverage such as the Earth hour; this is a worldwide grassroots movement uniting people to protect the planet, organised by WWF (World Wide Fund for Nature). Other …"
77,"DS Cruzes, T Dybå","Synthesizing evidence in software engineering research",2010,"… Symposium on Empirical Software Engineering …","dl.acm.org","https://dl.acm.org/doi/abs/10.1145/1852786.1852788","https://scholar.google.com/scholar?cites=5532186239017892962&as_sdt=2005&sciodt=0,5&hl=en",34,"2021-05-11 13:03:30","","","","",,,,,77,7.00,39,2,11,"Synthesizing the evidence from a set of studies that spans many countries and years, and that incorporates a wide variety of research methods and theoretical perspectives, is probably the single most challenging task of performing a systematic review. In this paper …"
60,"A Arpteg, B Brinne, L Crnkovic-Friis…","Software engineering challenges of deep learning",2018,"… Software Engineering …","ieeexplore.ieee.org","https://ieeexplore.ieee.org/abstract/document/8498185/","https://scholar.google.com/scholar?cites=3496482124688093322&as_sdt=2005&sciodt=0,5&hl=en",35,"2021-05-11 13:03:30","","","","",,,,,60,20.00,15,4,3,"Surprisingly promising results have been achieved by deep learning (DL) systems in recent years. Many of these achievements have been reached in academic settings, or by large technology companies with highly skilled research groups and advanced supporting …"
729,"M Harman, SA Mansouri, Y Zhang","Search-based software engineering: Trends, techniques and applications",2012,"ACM Computing Surveys (CSUR)","dl.acm.org","https://dl.acm.org/doi/abs/10.1145/2379776.2379787","https://scholar.google.com/scholar?cites=1454353810395296838&as_sdt=2005&sciodt=0,5&hl=en",36,"2021-05-11 13:03:30","","","","",,,,,729,81.00,243,3,9,"In the past five years there has been a dramatic increase in work on Search-Based Software Engineering (SBSE), an approach to Software Engineering (SE) in which Search-Based Optimization (SBO) algorithms are used to address problems in SE. SBSE has been applied …"
756,"A Arcuri, L Briand","A practical guide for using statistical tests to assess randomized algorithms in software engineering",2011,"… Conference on Software Engineering (ICSE …","ieeexplore.ieee.org","https://ieeexplore.ieee.org/abstract/document/6032439/","https://scholar.google.com/scholar?cites=15086517004316592566&as_sdt=2005&sciodt=0,5&hl=en",37,"2021-05-11 13:03:30","","","","",,,,,756,75.60,378,2,10,"Randomized algorithms have been used to successfully address many different types of software engineering problems. This type of algorithms employ a degree of randomness as part of their logic. Randomized algorithms are useful for difficult problems where a precise …"
103,"D Posnett, V Filkov, P Devanbu","Ecological inference in empirical software engineering",2011,"… Software Engineering (ASE …","ieeexplore.ieee.org","https://ieeexplore.ieee.org/abstract/document/6100074/","https://scholar.google.com/scholar?cites=6994049198280130435&as_sdt=2005&sciodt=0,5&hl=en",38,"2021-05-11 13:03:30","","","","",,,,,103,10.30,34,3,10,"Software systems are decomposed hierarchically, for example, into modules, packages and files. This hierarchical decomposition has a profound influence on evolvability, maintainability and work assignment. Hierarchical decomposition is thus clearly of central …"
112,"B Bruegge, S Krusche, L Alperowitz","Software engineering project courses with industrial clients",2015,"ACM Transactions on Computing …","dl.acm.org","https://dl.acm.org/doi/abs/10.1145/2732155","https://scholar.google.com/scholar?cites=4690111338997103007&as_sdt=2005&sciodt=0,5&hl=en",39,"2021-05-11 13:03:30","","","","",,,,,112,18.67,37,3,6,"There is an acknowledged need for teaching realistic software development in project courses. The design space for such courses is wide, ranging from single-semester to two-semester courses, from single-client to multicustomer courses, from local to globally …"
469,"B Fitzgerald, KJ Stol","Continuous software engineering: A roadmap and agenda",2017,"Journal of Systems and Software","Elsevier","https://www.sciencedirect.com/science/article/pii/S0164121215001430","https://scholar.google.com/scholar?cites=6651105162622199027&as_sdt=2005&sciodt=0,5&hl=en",40,"2021-05-11 13:03:30","","","","",,,,,469,117.25,235,2,4,"Throughout its short history, software development has been characterized by harmful disconnects between important activities such as planning, development and implementation. The problem is further exacerbated by the episodic and infrequent …"
