Cites,Authors,Title,Year,Source,Publisher,ArticleURL,CitesURL,GSRank,QueryDate,Type,DOI,ISSN,CitationURL,Volume,Issue,StartPage,EndPage,ECC,CitesPerYear,CitesPerAuthor,AuthorCount,Age,Abstract
574,"S Jansen, A Finkelstein…","A sense of community: A research agenda for software ecosystems",2009,"… on Software Engineering …","ieeexplore.ieee.org","https://ieeexplore.ieee.org/abstract/document/5070978/","https://scholar.google.com/scholar?cites=14454456867413646442&as_sdt=2005&sciodt=0,5&hl=en",352,"2021-05-11 13:03:30","","","","",,,,,574,47.83,191,3,12,"Software vendors lack the perspective to develop software within a software ecosystem. The inability to function in a software ecosystem has already led to the demise of many software vendors, leading to loss of competition, intellectual property, and eventually jobs in the …"
100,"T Honglei, S Wei, Z Yanan","The research on software metrics and software complexity metrics",2009,"2009 International Forum on …","ieeexplore.ieee.org","https://ieeexplore.ieee.org/abstract/document/5385114/","https://scholar.google.com/scholar?cites=11425937338828258089&as_sdt=2005&sciodt=0,5&hl=en",353,"2021-05-11 13:03:30","","","","",,,,,100,8.33,33,3,12,"… Therefore the quality of software can be monitored efficiently. Software metrics is very important in research of software engineering and it has developed gradually … Then the metrics types and its role playing in the software engineering are presented …"
650,"Y Brun, GDM Serugendo, C Gacek, H Giese…","Engineering self-adaptive systems through feedback loops",2009,"Software engineering for …","Springer","https://link.springer.com/chapter/10.1007/978-3-642-02161-9_3","https://scholar.google.com/scholar?cites=13692108246371196459&as_sdt=2005&sciodt=0,5&hl=en",354,"2021-05-11 13:03:30","","","","",,,,,650,54.17,130,5,12,"To deal with the increasing complexity of software systems and uncertainty of their environments, software engineers have turned to self-adaptivity. Self-adaptive systems are capable of dealing with a continuously changing environment and emerging requirements …"
27,"H Fischer","Integrating usability engineering in the software development lifecycle based on international standards",2012,"… of the 4th ACM SIGCHI symposium on Engineering …","dl.acm.org","https://dl.acm.org/doi/abs/10.1145/2305484.2305541","https://scholar.google.com/scholar?cites=7485704455001579245&as_sdt=2005&sciodt=0,5&hl=en",355,"2021-05-11 13:03:30","","","","",,,,,27,3.00,27,1,9,"The integration of usability activities into software development lifecycles still remains to be a challenge. Most of the existing integration approaches appear to be on an operational level and cannot be transferred to other processes. Furthermore, UE standards and methods are …"
50,"M Petre","Insights from expert software design practice",2009,"… 7th joint meeting of the European software engineering …","dl.acm.org","https://dl.acm.org/doi/abs/10.1145/1595696.1595731","https://scholar.google.com/scholar?cites=8184134186980094318&as_sdt=2005&sciodt=0,5&hl=en",356,"2021-05-11 13:03:30","","","","",,,,,50,4.17,50,1,12,"Software is a designed artifact. In other design disciplines, such as architecture, there is a well-established tradition of design studies which inform not only the discipline itself but also tool design, processes, and collaborative work. The'challenge'of this paper is to consider …"
48,"C Passos, AP Braun, DS Cruzes…","Analyzing the impact of beliefs in software project practices",2011,"… Software Engineering …","ieeexplore.ieee.org","https://ieeexplore.ieee.org/abstract/document/6092603/","https://scholar.google.com/scholar?cites=3704784782885991451&as_sdt=2005&sciodt=0,5&hl=en",357,"2021-05-11 13:03:30","","","","",,,,,48,4.80,12,4,10,"Folklore and beliefs are strong in the software practitioners' community. Software engineering is a communication intensive activity. Software engineers are innovation driven and regularly use automated resources to share ideas, new paradigms and approaches to …"
69,"S Wang, D Lo, L Jiang","Inferring semantically related software terms and their taxonomy by leveraging collaborative tagging",2012,"… International Conference on Software …","ieeexplore.ieee.org","https://ieeexplore.ieee.org/abstract/document/6405332/","https://scholar.google.com/scholar?cites=8151162788359315088&as_sdt=2005&sciodt=0,5&hl=en",358,"2021-05-11 13:03:30","","","","",,,,,69,7.67,23,3,9,"… Abstract—Many software engineering tasks, such as feature location and duplicate bug report detection, leverages simi- larities among textual corpora … Such word differences may cause inaccuracies in subsequent software engineering tasks …"
68,"M Kassab, C Neill, P Laplante","State of practice in requirements engineering: contemporary data",2014,"… in Systems and Software Engineering","Springer","https://link.springer.com/article/10.1007/s11334-014-0232-4","https://scholar.google.com/scholar?cites=8753870037852442917&as_sdt=2005&sciodt=0,5&hl=en",359,"2021-05-11 13:03:30","HTML","","","",,,,,68,9.71,23,3,7,"Little contemporary data exists that documents software requirements elicitation, requirements specification, document development, and specification validation practices. An exploratory survey of more than 3,000 software professionals was conducted and nearly …"
51,"C Ebert, J Favaro","Automotive software",2017,"IEEE Annals of the History of Computing","computer.org","https://www.computer.org/csdl/magazine/so/2017/03/mso2017030033/13rRUwInvd6","https://scholar.google.com/scholar?cites=15690670713745271495&as_sdt=2005&sciodt=0,5&hl=en",360,"2021-05-11 13:03:30","","","","",,,,,51,12.75,26,2,4,"… plants. Automotive Software Engineering. Developing automotive … of this article. 1 – 4. Overall, software engineering technology advances are today heavily driven by automotive manufacturers and suppliers. Examples include …"
67,"F Falcini, G Lami, AM Costanza","Deep learning in automotive software",2017,"IEEE Software","ieeexplore.ieee.org","https://ieeexplore.ieee.org/abstract/document/7927925/","https://scholar.google.com/scholar?cites=6890004311807774449&as_sdt=2005&sciodt=0,5&hl=en",361,"2021-05-11 13:03:30","","","","",,,,,67,16.75,22,3,4,"… and vehicle cybersecurity.3 (For some examples of the cur- rent use of deep learning in the au- tomotive domain, see the sidebar.) However, the introduction of deep- learning technology onboard cars is creating challenges for automotive software engineering, which must …"
58,"P Ralph","The illusion of requirements in software development",2013,"Requirements Engineering","Springer","https://link.springer.com/content/pdf/10.1007/s00766-012-0161-4.pdf","https://scholar.google.com/scholar?cites=12930184649770358295&as_sdt=2005&sciodt=0,5&hl=en",362,"2021-05-11 13:03:30","PDF","","","",,,,,58,7.25,58,1,8,"This viewpoint explores the possibility that many software development projects may have no useful requirements. Specifically, for problems (eg, knowledge worker burnout) with two completely different solutions (eg, better tool support or hire more employees), an analyst …"
170,"EC Foster","Human resource management",2014,"Software engineering","Springer","https://link.springer.com/chapter/10.1007/978-1-4842-0847-2_15","https://scholar.google.com/scholar?cites=158231324285947531&as_sdt=2005&sciodt=0,5&hl=en",363,"2021-05-11 13:03:30","","","","",,,,,170,24.29,170,1,7,"Human Resource Management (HRM) is arguably, the most important aspect of management in general. This argument can be easily supported, since the most important resource in any organization is the human resource … These keywords were added by machine and not by …"
114,"DL Parnas","Precise documentation: The key to better software",2011,"The Future of Software Engineering","Springer","https://link.springer.com/chapter/10.1007/978-3-642-15187-3_8","https://scholar.google.com/scholar?cites=1575804436889359203&as_sdt=2005&sciodt=0,5&hl=en",364,"2021-05-11 13:03:30","","","","",,,,,114,11.40,114,1,10,"The prime cause of the sorry “state of the art” in software development is our failure to produce good design documentation. Poor documentation is the cause of many errors and reduces efficiency in every phase of a software product's development and use. Most …"
57,"A Mockus","Engineering big data solutions",2014,"Future of Software Engineering Proceedings","dl.acm.org","https://dl.acm.org/doi/abs/10.1145/2593882.2593889","https://scholar.google.com/scholar?cites=7770005166071881503&as_sdt=2005&sciodt=0,5&hl=en",365,"2021-05-11 13:03:30","","","","",,,,,57,8.14,57,1,7,"Structured and unstructured data in operational support tools have long been prevalent in software engineering. Similar data is now becoming widely available in other domains. Software systems that utilize such operational data (OD) to help with software design and …"
727,"A Hindle, ET Barr, M Gabel, Z Su…","On the naturalness of software",2016,"Communications of the …","dl.acm.org","https://dl.acm.org/doi/abs/10.1145/2902362","https://scholar.google.com/scholar?cites=14558049290902271347&as_sdt=2005&sciodt=0,5&hl=en",366,"2021-05-11 13:03:30","","","","",,,,,727,145.40,145,5,5,"… methods of computational The original version of this paper was published in the Proceedings of the 34th International Conference on Software Engineering (2012), 837–847. All five authors were at UC Davis at the time. a This …"
8,"NH Bakar, ZM Kasirun, N Salleh, AH Halim","Extracting software features from online reviews to demonstrate requirements reuse in software engineering",2017,"","repo.uum.edu.my","http://repo.uum.edu.my/id/eprint/22822","https://scholar.google.com/scholar?cites=3025318577273449933&as_sdt=2005&sciodt=0,5&hl=en",367,"2021-05-11 13:03:30","","","","",,,,,8,2.00,2,4,4,"Software Product Lines Engineering is a systematic approach towards realizing software reuse. Among important artifacts to be reused includes requirements, architectures, source codes, designs or even test plans. Requirements reuse if done systematically can expedite …"
42,"C Murphy, MS Raunak, A King, S Chen…","On effective testing of health care simulation software",2011,"… software engineering …","dl.acm.org","https://dl.acm.org/doi/abs/10.1145/1987993.1988003","https://scholar.google.com/scholar?cites=8094238202783303676&as_sdt=2005&sciodt=0,5&hl=en",368,"2021-05-11 13:03:30","","","","",,,,,42,4.20,8,5,10,"Health care professionals rely on software to simulate anatomical and physiological elements of the human body for purposes of training, prototyping, and decision making. Software can also be used to simulate medical processes and protocols to measure cost …"
131,"GS Matharu, A Mishra, H Singh…","Empirical study of agile software development methodologies: A comparative analysis",2015,"… Software Engineering …","dl.acm.org","https://dl.acm.org/doi/abs/10.1145/2693208.2693233","https://scholar.google.com/scholar?cites=17593859977350534299&as_sdt=2005&sciodt=0,5&hl=en",369,"2021-05-11 13:03:30","","","","",,,,,131,21.83,33,4,6,"In today's software industry, technological prowess and ever-evolving customer requirements have led to more complex software demands. Agile based software development is increasingly being adopted by the software practitioners as it assures early …"
31,"X Larrucea, A Combelles, J Favaro","Safety-critical software [guest editors' introduction]",2013,"IEEE Software","ieeexplore.ieee.org","https://ieeexplore.ieee.org/abstract/document/6504883/","https://scholar.google.com/scholar?cites=9650890370840981577&as_sdt=2005&sciodt=0,5&hl=en",370,"2021-05-11 13:03:30","","","","",,,,,31,3.88,10,3,8,"… discipline of safety-critical software systems development as a broad range of software engineering methods, tools, and frameworks are revisited from a safety-related perspective … Larrucea has a PhD in software engineering from the University of the Basque Country …"
54,"C Casado-Lumbreras, R Colomo-Palacios…","Culture dimensions in software development industry: The effects of mentoring",2011,"","e-archivo.uc3m.es","http://e-archivo.uc3m.es/handle/10016/14307","https://scholar.google.com/scholar?cites=7076021556203379393&as_sdt=2005&sciodt=0,5&hl=en",371,"2021-05-11 13:03:30","","","","",,,,,54,5.40,18,3,10,"… However, software engineering is being further affected because of the globalization in software development … This paper analyzes the influence of culture on mentoring relationships within the software engineering industry …"
89,"PRJ Campbell, F Ahmed","A three-dimensional view of software ecosystems",2010,"… the Fourth European Conference on Software …","dl.acm.org","https://dl.acm.org/doi/abs/10.1145/1842752.1842774","https://scholar.google.com/scholar?cites=4329248963355618147&as_sdt=2005&sciodt=0,5&hl=en",372,"2021-05-11 13:03:30","","","","",,,,,89,8.09,45,2,11,"… software. Categories and Subject Descriptors D.2 Software Engineering, K.6.3 Software Management, Software development, Software process,D.2.11 Software Architectures, D.2.13 Reusable Software, Domain engineering …"
118,"N Condori-Fernandez, M Daneva…","A systematic mapping study on empirical evaluation of software requirements specifications techniques",2009,"… Engineering and …","ieeexplore.ieee.org","https://ieeexplore.ieee.org/abstract/document/5314232/","https://scholar.google.com/scholar?cites=857870866724839007&as_sdt=2005&sciodt=0,5&hl=en",373,"2021-05-11 13:03:30","","","","",,,,,118,9.83,39,3,12,"This paper describes an empirical mapping study, which was designed to identify what aspects of software requirement specifications (SRS) are empirically evaluated, in which context, and by using which research method. On the basis of 46 identified and categorized …"
5,"RS Pressman, J Rambaugh, S Ville, WS Jawadekar","Software Engineering: A Practitioner's Approach”, TMH",2010,"Architecture","rku.ac.in","http://www.rku.ac.in/syllabus/syllabus/0005-2016-2017-RKU.pdf","https://scholar.google.com/scholar?cites=9784476432512665174&as_sdt=2005&sciodt=0,5&hl=en",374,"2021-05-11 13:03:30","PDF","","","",,,,,5,0.45,1,4,11,"3 0 2 4 N Y Y … 2 0 4 4 N Y Y … CE518 Enterprise Computing Through .NET Frameworks 3 0 2 4 N Y Y … CE521 Mobile Application Development 2 0 4 4 N Y Y … EC509 Microprocessor & Microcontroller 3 0 2 4 N Y Y … Elective - I 3 0 0 3 N Y N … PC501 Rural Internship 0 0 0 …"
8,"JH Kim, RS Reddy","Implementation of Mobile Apps Across Globe and Challenge to Software Engineering",2015,"","dspace.kci.go.kr","http://dspace.kci.go.kr/handle/kci/497704","https://scholar.google.com/scholar?cites=2446784830248592656&as_sdt=2005&sciodt=0,5&hl=en",375,"2021-05-11 13:03:30","","","","",,,,,8,1.33,4,2,6,"The market for mobile apps is already big and it's just going to keep getting bigger. According to a recent study in 2015, 1 billion smartphones will be sold, that is twice as many as the number of personal computers right now, the average mobile app user spends more …"
70,"M Mukadam, C Bird, PC Rigby","Gerrit software code review data from android",2013,"… on Mining Software …","ieeexplore.ieee.org","https://ieeexplore.ieee.org/document/6624002/","https://scholar.google.com/scholar?cites=7744327159721016151&as_sdt=2005&sciodt=0,5&hl=en",376,"2021-05-11 13:03:30","","","","",,,,,70,8.75,23,3,8,"… We describe the Android peer review process, the reverse engineering of the Gerrit JSON API, our data mining and cleaning methodology, database schema, and provide an example of how the data can be used to answer an empirical software engineering question …"
83,"L Šubelj, M Bajec","Community structure of complex software systems: Analysis and applications",2011,"Physica A: Statistical Mechanics and its Applications","Elsevier","https://www.sciencedirect.com/science/article/pii/S037843711100269X","https://scholar.google.com/scholar?cites=14299706099593104287&as_sdt=2005&sciodt=0,5&hl=en",377,"2021-05-11 13:03:30","","","","",,,,,83,8.30,42,2,10,"… Abstract. Due to notable discoveries in the fast evolving field of complex networks, recent research in software engineering has also focused on representing software systems with networks … 4.3. Applications of community detection to software engineering …"
72,"F Albertao, J Xiao, C Tian, Y Lu…","Measuring the sustainability performance of software projects",2010,"… Business Engineering","ieeexplore.ieee.org","https://ieeexplore.ieee.org/abstract/document/5704342/","https://scholar.google.com/scholar?cites=1659967663611815572&as_sdt=2005&sciodt=0,5&hl=en",378,"2021-05-11 13:03:30","","","","",,,,,72,6.55,14,5,11,"Contrary to the common assumption that software is"" environmentally friendly"" simply because it is virtual, the processes and methods used to develop, maintain and deploy software do have an environmental and social impact that is normally not accounted for by …"
43,"J Happe, H Koziolek, R Reussner","Facilitating performance predictions using software components",2011,"IEEE software","ieeexplore.ieee.org","https://ieeexplore.ieee.org/abstract/document/5719590/","https://scholar.google.com/scholar?cites=10180129023749741293&as_sdt=2005&sciodt=0,5&hl=en",379,"2021-05-11 13:03:30","","","","",,,,,43,4.30,14,3,10,"… Jens Happe SAP Research Software Engineering & Tools Vincenz-Priessnitz-Str … The paradigm of component-based software engineering (CBSE) poses additional challenges for the prediction and evaluation of software performance but also offers several advantages …"
95,"V Rajlich","Software evolution and maintenance",2014,"Future of Software Engineering Proceedings","dl.acm.org","https://dl.acm.org/doi/abs/10.1145/2593882.2593893","https://scholar.google.com/scholar?cites=14754588709266452969&as_sdt=2005&sciodt=0,5&hl=en",380,"2021-05-11 13:03:30","","","","",,,,,95,13.57,95,1,7,"Successful software requires constant change that is triggered by evolving requirements, technologies, and stakeholder knowledge. This constant change constitutes software evolution. Software evolution has gained steadily in importance and recently moved into the …"
105,"T Parveen, S Tilley","When to migrate software testing to the cloud?",2010,"… International Conference on Software …","ieeexplore.ieee.org","https://ieeexplore.ieee.org/abstract/document/5463680/","https://scholar.google.com/scholar?cites=14590380474350155040&as_sdt=2005&sciodt=0,5&hl=en",381,"2021-05-11 13:03:30","","","","",,,,,105,9.55,53,2,11,"… tparveen@fit.edu stilley@cs.fit.edu Abstract—Testing is a challenging activity for many software engineering projects, especially for large-scale systems … The unfortunate truth is that most people tend to forget that test automation requires software engineering as well [14] …"
6,"P Kamthan","On the nature of collaborations in agile software engineering course projects",2021,"Research Anthology on Recent Trends, Tools, and …","igi-global.com","https://www.igi-global.com/chapter/on-the-nature-of-collaborations-in-agile-software-engineering-course-projects/261088","https://scholar.google.com/scholar?cites=17855511315521624043&as_sdt=2005&sciodt=0,5&hl=en",382,"2021-05-11 13:03:30","","","","",,,,,6,6.00,6,1,1,"If there is a constant in software development, then it is that its ecosystem is a variable. The agile methodologies are part of a relatively recent shift from predictive to adaptive approach towards software development. This change has had a notable impact on software …"
70,"R Chitchyan, C Becker, S Betz, L Duboc…","Sustainability design in requirements engineering: state of practice",2016,"… Software Engineering …","dl.acm.org","https://dl.acm.org/doi/abs/10.1145/2889160.2889217","https://scholar.google.com/scholar?cites=12494877968955079325&as_sdt=2005&sciodt=0,5&hl=en",383,"2021-05-11 13:03:30","","","","",,,,,70,14.00,14,5,5,"Sustainability is now a major concern in society, but there is little understanding of how it is perceived by software engineering professionals and how sustainability design can become an embedded part of software engineering process. This paper presents the results of a …"
501,"Y Bassil","A simulation model for the waterfall software development life cycle",2012,"arXiv preprint arXiv:1205.6904","arxiv.org","https://arxiv.org/abs/1205.6904","https://scholar.google.com/scholar?cites=11507618369488543708&as_sdt=2005&sciodt=0,5&hl=en",384,"2021-05-11 13:03:30","","","","",,,,,501,55.67,501,1,9,"… Keywords: Software Engineering, SDLC, Waterfall Model, Computer Simulation, Simphony.NET … [10] described three types of simulation methodologies. The first is called “simulation as software engineering” and revolves around simulating the delivery of a product …"
73,"M Kropp, A Meier","Teaching agile software development at university level: Values, management, and craftsmanship",2013,"… Conference on Software Engineering …","ieeexplore.ieee.org","https://ieeexplore.ieee.org/abstract/document/6595249/","https://scholar.google.com/scholar?cites=8922165819762434764&as_sdt=2005&sciodt=0,5&hl=en",385,"2021-05-11 13:03:30","","","","",,,,,73,9.13,37,2,8,"Agile methodologies have come a long way over the last decade. Several recent surveys show that agile methodologies like Scrum, Extreme Programming and, more recently, Kanban have been successfully adopted by many companies to develop their software …"
67,"DIK Sjøberg, B Anda, A Mockus","Questioning software maintenance metrics: a comparative case study",2012,"… Software Engineering and …","ieeexplore.ieee.org","https://ieeexplore.ieee.org/abstract/document/6475403/","https://scholar.google.com/scholar?cites=15707482087824481969&as_sdt=2005&sciodt=0,5&hl=en",386,"2021-05-11 13:03:30","","","","",,,,,67,7.44,22,3,9,"Context: Many metrics are used in software engineering research as surrogates for maintainability of software systems. Aim: Our aim was to investigate whether such metrics are consistent among themselves and the extent to which they predict maintenance effort at …"
80,"T Spitta","Software engineering und prototyping: eine Konstruktionslehre für administrative Softwaresysteme",2013,"","books.google.com","https://books.google.com/books?hl=en&lr=&id=VsahBgAAQBAJ&oi=fnd&pg=PA2&dq=software+engineering&ots=tahu6hFqlH&sig=CZGSp4UQpwfOcE7YDklpZGgzOyk","https://scholar.google.com/scholar?cites=18270030370692635701&as_sdt=2005&sciodt=0,5&hl=en",387,"2021-05-11 13:03:30","BOOK","","","",,,,,80,10.00,80,1,8,"Als erste Monographie im deutschsprachigen Raum vermittelt das vorliegende Buch eine Konstruktionslehre des Software Engineering über den gesamten Lebenszyklus eines Softwareproduktes. Während Software-Technologie üblicherweise in Hochschulen oder …"
73,"G O'Regan","Introduction to software process improvement",2010,"","books.google.com","https://books.google.com/books?hl=en&lr=&id=IBZkuEPUeiIC&oi=fnd&pg=PR9&dq=software+engineering&ots=tnwlM1SD7r&sig=mKLLHUEL0ftaEkRMi1CO84kWuNo","https://scholar.google.com/scholar?cites=1144436148055555589&as_sdt=2005&sciodt=0,5&hl=en",388,"2021-05-11 13:03:30","BOOK","","","",,,,,73,6.64,73,1,11,"… The well-known Capability Maturity Model Integration (CMMI1) is used as the vehicle for software process improvement as it has become the de facto standard2 for implementing best practice in software engineering … 11 2 Software Engineering …"
37,"A Adewumi, S Misra, N Omoregbe","A review of models for evaluating quality in open source software",2013,"IERI Procedia","Elsevier","https://www.sciencedirect.com/science/article/pii/S2212667813000178","https://scholar.google.com/scholar?cites=16108978808999493436&as_sdt=2005&sciodt=0,5&hl=en",389,"2021-05-11 13:03:30","","","","",,,,,37,4.63,12,3,8,"… Proceedings of the 2nd International Conference on Software Engineering, 1976. [3] Boehm BW, Brown JR, Kaspar H, Lipow M, McLeod G, Merritt M. Characteristics of Software Quality. Vol … ISO 9126-1:2001, Software engineering - Product quality, Part 1: Quality model, 2001 …"
28,"J Knodel, K Manikas","Towards a typification of software ecosystems",2015,"International Conference of Software Business","Springer","https://link.springer.com/chapter/10.1007/978-3-319-19593-3_5","https://scholar.google.com/scholar?cites=6781027096860444413&as_sdt=2005&sciodt=0,5&hl=en",390,"2021-05-11 13:03:30","","","","",,,,,28,4.67,14,2,6,"… 1 Fraunhofer Institute for Experimental Software Engineering (IESE), Fraunhofer-Platz 1, 67663 Kaiserslautern, Germany jens.knodel@iese.fraunhofer.de 2 Department of Computer Science (DIKU), University of Copenhagen, Copenhagen, Denmark kmanikas@di.ku.dk …"
63,"HK Dam, T Tran, A Ghose","Explainable software analytics",2018,"… on Software Engineering: New Ideas and …","dl.acm.org","https://dl.acm.org/doi/abs/10.1145/3183399.3183424","https://scholar.google.com/scholar?cites=15657135124609203216&as_sdt=2005&sciodt=0,5&hl=en",391,"2021-05-11 13:03:30","","","","",,,,,63,21.00,21,3,3,"Software analytics has been the subject of considerable recent attention but is yet to receive significant industry traction. One of the key reasons is that software practitioners are reluctant to trust predictions produced by the analytics machinery without understanding the rationale …"
1384,"L Osterweil","Software processes are software too",2011,"Engineering of Software","Springer","https://link.springer.com/chapter/10.1007/978-3-642-19823-6_17","https://scholar.google.com/scholar?cites=18084349338885635199&as_sdt=2005&sciodt=0,5&hl=en",392,"2021-05-11 13:03:30","","","","",,,,,1384,138.40,1384,1,10,"The major theme of this meeting is the exploration of the importance of process as a vehicle for improving both the quality of software products and the way in which we develop and evolve them. In beginning this exploration it seems important to spend at least a short time …"
