Cites,Authors,Title,Year,Source,Publisher,ArticleURL,CitesURL,GSRank,QueryDate,Type,DOI,ISSN,CitationURL,Volume,Issue,StartPage,EndPage,ECC,CitesPerYear,CitesPerAuthor,AuthorCount,Age,Abstract
36,"T Storer","Bridging the chasm: A survey of software engineering practice in scientific programming",2017,"ACM Computing Surveys (CSUR)","dl.acm.org","https://dl.acm.org/doi/abs/10.1145/3084225","https://scholar.google.com/scholar?cites=1174503491617739946&as_sdt=2005&sciodt=0,5&hl=en",119,"2021-05-11 13:03:30","","","","",,,,,36,9.00,36,1,4,"The use of software is pervasive in all fields of science. Associated software development efforts may be very large, long lived, and complex, requiring the commitment of significant resources. However, several authors have argued that the “gap” or “chasm” between …"
39,"Q Taylor, C Giraud-Carrier…","Applications of data mining in software engineering",2010,"International Journal of …","inderscienceonline.com","https://www.inderscienceonline.com/doi/abs/10.1504/IJDATS.2010.034058","https://scholar.google.com/scholar?cites=8919357881814060682&as_sdt=2005&sciodt=0,5&hl=en",120,"2021-05-11 13:03:30","","","","",,,,,39,3.55,13,3,11,"Software engineering processes are complex, and the related activities often produce a large number and variety of artefacts, making them well-suited to data mining. Recent years have seen an increase in the use of data mining techniques on such artefacts with the goal …"
71,"ID Coman, A Sillitti, G Succi","A case-study on using an automated in-process software engineering measurement and analysis system in an industrial environment",2009,"… on Software Engineering","ieeexplore.ieee.org","https://ieeexplore.ieee.org/abstract/document/5070511/","https://scholar.google.com/scholar?cites=14570753407929104114&as_sdt=2005&sciodt=0,5&hl=en",121,"2021-05-11 13:03:30","","","","",,,,,71,5.92,24,3,12,"Automated systems for measurement and analysis are not adopted on a large scale in companies, despite the opportunities they offer. The fear of the ldquobig brotherrdquo and the lack of reports giving insights into the real adoption process and concrete usages in …"
91,"R Jongeling, S Datta…","Choosing your weapons: On sentiment analysis tools for software engineering research",2015,"… Conference on Software …","ieeexplore.ieee.org","https://ieeexplore.ieee.org/abstract/document/7332508/","https://scholar.google.com/scholar?cites=2751403037960342968&as_sdt=2005&sciodt=0,5&hl=en",122,"2021-05-11 13:03:30","","","","",,,,,91,15.17,30,3,6,"Recent years have seen an increasing attention to social aspects of software engineering, including studies of emotions and sentiments experienced and expressed by the software developers. Most of these studies reuse existing sentiment analysis tools such as …"
58,"D Rodriguez, I Herraiz…","On software engineering repositories and their open problems",2012,"… in Software Engineering …","ieeexplore.ieee.org","https://ieeexplore.ieee.org/abstract/document/6227971/","https://scholar.google.com/scholar?cites=10133220016560991185&as_sdt=2005&sciodt=0,5&hl=en",123,"2021-05-11 13:03:30","","","","",,,,,58,6.44,19,3,9,"In the last decade, a large number of software repositories have been created for different purposes. In this paper we present a survey of the publicly available repositories and classify the most common ones as well as discussing the problems faced by researchers …"
53,"SC Dos Santos, MCM Batista…","Applying PBL in software engineering education",2009,"… Engineering …","ieeexplore.ieee.org","https://ieeexplore.ieee.org/abstract/document/4812695/","https://scholar.google.com/scholar?cites=826802476746604744&as_sdt=2005&sciodt=0,5&hl=en",124,"2021-05-11 13:03:30","","","","",,,,,53,4.42,18,3,12,"The Information Communication and Technology-ICT industry is facing a market of constant changes and challenges. These characteristics demand the ICT professionals to have a wide vision of the problem, rather than just knowledge on the technology. In this context, the …"
88,"FJ García-Peñalvo, R Colomo-Palacios, J García…","Towards an ontology modeling tool. A validation in software engineering scenarios",2012,"Expert Systems with …","Elsevier","https://www.sciencedirect.com/science/article/pii/S0957417412006069","https://scholar.google.com/scholar?cites=7886025813721900861&as_sdt=2005&sciodt=0,5&hl=en",125,"2021-05-11 13:03:30","","","","",,,,,88,9.78,22,4,9,"Ontology creation and management related processes are very important to define and develop semantic services. Ontology Engineering is the research field that provides the mechanisms to manage the life cycle of the ontologies. However, the process of building …"
45,"W Li, P Azar, D Larochelle, P Hill, AW Lo","Law is code: a software engineering approach to analyzing the united states code",2015,"J. Bus. & Tech. L.","HeinOnline","https://heinonline.org/hol-cgi-bin/get_pdf.cgi?handle=hein.journals/jobtela10&section=19","https://scholar.google.com/scholar?cites=3819725164670885318&as_sdt=2005&sciodt=0,5&hl=en",126,"2021-05-11 13:03:30","","","","",,,,,45,7.50,9,5,6,"The agglomeration of rules and regulations over time has produced a body of legal code that no single individual can fully comprehend. This complexity produces inefficiencies, makes the processes of understanding and changing the law difficult, and frustrates the …"
54,"D Graziotin, X Wang, P Abrahamsson","Understanding the affect of developers: theoretical background and guidelines for psychoempirical software engineering",2015,"… on social software engineering","dl.acm.org","https://dl.acm.org/doi/abs/10.1145/2804381.2804386","https://scholar.google.com/scholar?cites=11218887435225788044&as_sdt=2005&sciodt=0,5&hl=en",127,"2021-05-11 13:03:30","","","","",,,,,54,9.00,18,3,6,"ABSTRACT Affects--emotions and moods--have an impact on cognitive processing activities and the working performance of individuals. It has been established that software development tasks are undertaken through cognitive processing activities. Therefore, we …"
27,"S Semerikov, A Striuk, L Striuk, M Striuk…","Sustainability in Software Engineering Education: a case of general professional competencies",2020,"E3S Web of …","e3s-conferences.org","https://www.e3s-conferences.org/articles/e3sconf/abs/2020/26/e3sconf_icsf2020_10036/e3sconf_icsf2020_10036.html","https://scholar.google.com/scholar?cites=8683284042989128699&as_sdt=2005&sciodt=0,5&hl=en",128,"2021-05-11 13:03:30","","","","",,,,,27,27.00,5,5,1,"The article considers the application of the sustainable development concept to software engineering specialists training. A system of general professional competencies is designed to build sustainable professional competence of software engineering specialist: 1) ability for …"
92,"C Caulfield, JC Xia, D Veal, S Maj","A systematic survey of games used for software engineering education",2011,"Modern Applied Science","espace.curtin.edu.au","https://espace.curtin.edu.au/bitstream/handle/20.500.11937/13877/169900_169900.pdf?sequence=2","https://scholar.google.com/scholar?cites=7773096241682799821&as_sdt=2005&sciodt=0,5&hl=en",129,"2021-05-11 13:03:30","PDF","","","",,,,,92,9.20,23,4,10,"Simsoft is a serious game—one that trains or educates—at the centre of a research project designed to see if and how games can contribute to better software engineering management education by helping software engineers and project managers explore some …"
90,"S Aleem, LF Capretz, F Ahmed","Game development software engineering process life cycle: a systematic review",2016,"… of Software Engineering …","jserd.springeropen.com","https://jserd.springeropen.com/articles/10.1186/s40411-016-0032-7","https://scholar.google.com/scholar?cites=14303633128298628570&as_sdt=2005&sciodt=0,5&hl=en",130,"2021-05-11 13:03:30","HTML","","","",,,,,90,18.00,30,3,5,"Software game is a kind of application that is used not only for entertainment, but also for serious purposes that can be applicable to different domains such as education, business, and health care. Multidisciplinary nature of the game development processes that combine …"
35,"TM Khoshgoftaar","Software engineering with computational intelligence",2012,"","books.google.com","https://books.google.com/books?hl=en&lr=&id=BV_lBwAAQBAJ&oi=fnd&pg=PR7&dq=software+engineering&ots=XISa1od_dF&sig=MlOb00zxVuXzAax4agFC2_pgtPs","https://scholar.google.com/scholar?cites=6758203773174377612&as_sdt=2005&sciodt=0,5&hl=en",131,"2021-05-11 13:03:30","BOOK","","","",,,,,35,3.89,35,1,9,"The constantly evolving technological infrastructure of the modem world presents a great challenge of developing software systems with increasing size, complexity, and functionality. The software engineering field has seen changes and innovations to meet these and other …"
43,"J Grundy, G Kaefer, J Keung, A Liu","Guest editors' introduction: Software engineering for the cloud",2012,"IEEE software","ieeexplore.ieee.org","https://ieeexplore.ieee.org/abstract/document/6155142/","https://scholar.google.com/scholar?cites=9454945654702370626&as_sdt=2005&sciodt=0,5&hl=en",132,"2021-05-11 13:03:30","","","","",,,,,43,4.78,11,4,9,"Cloud computing is a new paradigm for software systems where applications are divided into sets of composite services hosted on leased, highly distributed platforms. There are many new software engineering challenges in building effective cloud-based software …"
28,"P Green II, T Menzies, S Williams…","Understanding the value of software engineering technologies",2009,"… Software Engineering","ieeexplore.ieee.org","https://ieeexplore.ieee.org/abstract/document/5431782/","https://scholar.google.com/scholar?cites=7809322421754405351&as_sdt=2005&sciodt=0,5&hl=en",133,"2021-05-11 13:03:30","","","","",,,,,28,2.33,7,4,12,"When AI search methods are applied to software process models, then appropriate technologies can be discovered for a software project. We show that those recommendations are greatly affected by the business context of its use. For example, the …"
42,"C Ebert, M Kuhrmann…","Global software engineering: Evolution and trends",2016,"… Software Engineering …","ieeexplore.ieee.org","https://ieeexplore.ieee.org/abstract/document/7577432/","https://scholar.google.com/scholar?cites=4403088189285361865&as_sdt=2005&sciodt=0,5&hl=en",134,"2021-05-11 13:03:30","","","","",,,,,42,8.40,14,3,5,"Professional software products and IT systems and services today are developed mostly by globally distributed teams, projects, and companies. Successfully orchestrating Global Software Engineering (GSE) has become the major success factor both for organizations …"
28,"K Gary, T Lindquist, S Bansal…","A project spine for software engineering curricular design",2013,"… on Software Engineering …","ieeexplore.ieee.org","https://ieeexplore.ieee.org/abstract/document/6595265/","https://scholar.google.com/scholar?cites=1510325593300221858&as_sdt=2005&sciodt=0,5&hl=en",135,"2021-05-11 13:03:30","","","","",,,,,28,3.50,7,4,8,"Software engineering education is a technologically challenging, rapidly evolving discipline. Like all STEM educators, software engineering educators are bombarded with a constant stream of new tools and techniques (MOOCs! Active learning! Inverted classrooms!) while …"
48,"A Scharf, A Koch","Scrum in a software engineering course: An in-depth praxis report",2013,"… Conference on Software Engineering …","ieeexplore.ieee.org","https://ieeexplore.ieee.org/abstract/document/6595247/","https://scholar.google.com/scholar?cites=9889223144549248879&as_sdt=2005&sciodt=0,5&hl=en",136,"2021-05-11 13:03:30","","","","",,,,,48,6.00,24,2,8,"Working in a team for a limited period of time and to deliver a high quality product are some of the skills students should gain during their studies at the university. Therefore universities should offer software engineering courses teaching agile methodologies broadly used in the …"
82,"J Andersson, L Baresi, N Bencomo…","Software engineering processes for self-adaptive systems",2013,"Software Engineering for …","Springer","https://link.springer.com/chapter/10.1007/978-3-642-35813-5_3","https://scholar.google.com/scholar?cites=3394711109653376252&as_sdt=2005&sciodt=0,5&hl=en",137,"2021-05-11 13:03:30","","","","",,,,,82,10.25,21,4,8,"In this paper, we discuss how for self-adaptive systems some activities that traditionally occur at development-time are moved to run-time. Responsibilities for these activities shift from software engineers to the system itself, causing the traditional boundary between …"
57,"M Kosa, M Yilmaz, R O'Connor, P Clarke","Software engineering education and games: a systematic literature review",2016,"Journal of Universal Computer …","jucs.org","http://jucs.org/jucs_22_12/software_engineering_education_and/jucs_22_12_1558_1574_kosa.pdf","https://scholar.google.com/scholar?cites=13671059661069416277&as_sdt=2005&sciodt=0,5&hl=en",138,"2021-05-11 13:03:30","","","","",,,,,57,11.40,14,4,5,"The trend in using games in elementary level education also spreads through higher education levels and specific domains such as engineering. Recently, researchers have shown an increased interest in the usage of games in software engineering. In this paper …"
77,"JA Macías","Enhancing project-based learning in software engineering lab teaching through an e-portfolio approach",2012,"IEEE Transactions on Education","ieeexplore.ieee.org","https://ieeexplore.ieee.org/abstract/document/6182725/","https://scholar.google.com/scholar?cites=1517376664887465305&as_sdt=2005&sciodt=0,5&hl=en",139,"2021-05-11 13:03:30","","","","",,,,,77,8.56,77,1,9,"Project-based learning is one of the main successful student-centered pedagogies broadly used in computing science courses. However, this approach can be insufficient when dealing with practical subjects that implicitly require many deliverables and a great deal of …"
94,"W Afzal, R Torkar","On the application of genetic programming for software engineering predictive modeling: A systematic review",2011,"Expert Systems with Applications","Elsevier","https://www.sciencedirect.com/science/article/pii/S0957417411004490","https://scholar.google.com/scholar?cites=1430727403074497212&as_sdt=2005&sciodt=0,5&hl=en",140,"2021-05-11 13:03:30","","","","",,,,,94,9.40,47,2,10,"The objective of this paper is to investigate the evidence for symbolic regression using genetic programming (GP) being an effective method for prediction and estimation in software engineering, when compared with regression/machine learning models and other …"
121,"V Garousi, K Petersen, B Ozkan","Challenges and best practices in industry-academia collaborations in software engineering: A systematic literature review",2016,"Information and Software Technology","Elsevier","https://www.sciencedirect.com/science/article/pii/S0950584916301203","https://scholar.google.com/scholar?cites=945618864000095906&as_sdt=2005&sciodt=0,5&hl=en",141,"2021-05-11 13:03:30","","","","",,,,,121,24.20,40,3,5,"Context: The global software industry and the software engineering (SE) academia are two large communities. However, unfortunately, the level of joint industry-academia collaborations in SE is still relatively very low, compared to the amount of activity in each of …"
73,"RA Maurício, L Veado, RT Moreira, E Figueiredo…","A systematic mapping study on game-related methods for software engineering education",2018,"Information and software …","Elsevier","https://www.sciencedirect.com/science/article/pii/S0950584917303518","https://scholar.google.com/scholar?cites=1857286907707008172&as_sdt=2005&sciodt=0,5&hl=en",142,"2021-05-11 13:03:30","","","","",,,,,73,24.33,15,5,3,"Context The use of games in software engineering education is not new. However, recent technologies have provided new opportunities for using games and their elements to enhance learning and student engagement. Objective The goal of this paper is twofold. First …"
110,"MA Babar, H Zhang","Systematic literature reviews in software engineering: Preliminary results from interviews with researchers",2009,"… on Empirical Software Engineering and …","ieeexplore.ieee.org","https://ieeexplore.ieee.org/abstract/document/5314235/","https://scholar.google.com/scholar?cites=15358837913355878275&as_sdt=2005&sciodt=0,5&hl=en",143,"2021-05-11 13:03:30","","","","",,,,,110,9.17,55,2,12,"Systematic Literature Reviews (SLRs) have been gaining significant attention from software engineering researchers since 2004. Several researchers have reported their experiences of and lessons learned from applying systematic reviews to different subject matters in …"
81,"M Harman","The relationship between search based software engineering and predictive modeling",2010,"… on Predictive Models in Software Engineering","dl.acm.org","https://dl.acm.org/doi/abs/10.1145/1868328.1868330","https://scholar.google.com/scholar?cites=17118533574128337744&as_sdt=2005&sciodt=0,5&hl=en",144,"2021-05-11 13:03:30","","","","",,,,,81,7.36,81,1,11,"ABSTRACT Search Based Software Engineering (SBSE) is an approach to software engineering in which search based optimization algorithms are used to identify optimal or near optimal solutions and to yield insight. SBSE techniques can cater for multiple, possibly …"
1523,"A Van Lamsweerde","Requirements engineering: From system goals to UML models to software",2009,"","philadelphia.edu.jo","https://www.philadelphia.edu.jo/it/se/syllabus/721230.pdf","https://scholar.google.com/scholar?cites=6512310675764345487&as_sdt=2005&sciodt=0,5&hl=en",145,"2021-05-11 13:03:30","BOOK","","","",,,,,1523,126.92,1523,1,12,"1. Understand the basic concepts related to requirements engineering (A2) 2. Recognise the importance of the requirement phase in the software development process (A1) 3. Recognise some requirements-related problems that can arise on a software project (A4) 4 …"
61,"A Kasoju, K Petersen, MV Mäntylä","Analyzing an automotive testing process with evidence-based software engineering",2013,"Information and Software Technology","Elsevier","https://www.sciencedirect.com/science/article/pii/S0950584913000165","https://scholar.google.com/scholar?cites=5637657478724308093&as_sdt=2005&sciodt=0,5&hl=en",146,"2021-05-11 13:03:30","","","","",,,,,61,7.63,20,3,8,"Context Evidence-based software engineering (EBSE) provides a process for solving practical problems based on a rigorous research approach. The primary focus so far was on mapping and aggregating evidence through systematic reviews. Objectives We extend …"
79,"AS Sayyad, H Ammar","Pareto-optimal search-based software engineering (POSBSE): A literature survey",2013,"… Synergies in Software Engineering …","ieeexplore.ieee.org","https://ieeexplore.ieee.org/abstract/document/6615200/","https://scholar.google.com/scholar?cites=5970843566359690361&as_sdt=2005&sciodt=0,5&hl=en",147,"2021-05-11 13:03:30","","","","",,,,,79,9.88,40,2,8,"The Search-Based Software Engineering (SBSE) community is increasingly recognizing the inherit “multiobjectiveness” in Software Engineering problems. The old ways of aggregating all objectives into one may very well be behind us. We perform a well-deserved literature …"
66,"D Èmite, C Wohlin","A whisper of evidence in global software engineering",2011,"IEEE software","ieeexplore.ieee.org","https://ieeexplore.ieee.org/abstract/document/5929523/","https://scholar.google.com/scholar?cites=10778669414052082922&as_sdt=2005&sciodt=0,5&hl=en",148,"2021-05-11 13:03:30","","","","",,,,,66,6.60,33,2,10,"A systematic review of global software engineering (GSE) literature from 2000 to 2007 shows the field to be immature. Studies report many challenges but little evidence regarding specific GSE practices directly related to project success or failure. There is evidence that …"
78,"M Kuhrmann, DM Fernández, M Daneva","On the pragmatic design of literature studies in software engineering: an experience-based guideline",2017,"Empirical software engineering","Springer","https://link.springer.com/article/10.1007/s10664-016-9492-y","https://scholar.google.com/scholar?cites=8442590237942243557&as_sdt=2005&sciodt=0,5&hl=en",149,"2021-05-11 13:03:30","","","","",,,,,78,19.50,26,3,4,"Systematic literature studies have received much attention in empirical software engineering in recent years. They have become a powerful tool to collect and structure reported knowledge in a systematic and reproducible way. We distinguish systematic literature …"
53,"N Novielli, D Girardi, F Lanubile","A benchmark study on sentiment analysis for software engineering research",2018,"… on Mining Software …","ieeexplore.ieee.org","https://ieeexplore.ieee.org/abstract/document/8595220/","https://scholar.google.com/scholar?cites=6343552543866994556&as_sdt=2005&sciodt=0,5&hl=en",150,"2021-05-11 13:03:30","","","","",,,,,53,17.67,18,3,3,"A recent research trend has emerged to identify developers' emotions, by applying sentiment analysis to the content of communication traces left in collaborative development environments. Trying to overcome the limitations posed by using off-the-shelf sentiment …"
59,"NH Madhavji, A Miranskyy…","Big picture of big data software engineering: with example research challenges",2015,"… Software Engineering","ieeexplore.ieee.org","https://ieeexplore.ieee.org/abstract/document/7165992/","https://scholar.google.com/scholar?cites=5475457579778719043&as_sdt=2005&sciodt=0,5&hl=en",151,"2021-05-11 13:03:30","","","","",,,,,59,9.83,20,3,6,"In the rapidly growing field of Big Data, we note that a disproportionately larger amount of effort is being invested in infrastructure development and data analytics in comparison to applications software development--approximately a 80: 20 ratio. This prompted us to create …"
80,"M Dick, S Naumann","Enhancing Software Engineering Processes towards Sustainable Software Product Design.",2010,"EnviroInfo","Citeseer","http://citeseerx.ist.psu.edu/viewdoc/download?doi=10.1.1.1070.7525&rep=rep1&type=pdf","https://scholar.google.com/scholar?cites=17816578841200459052&as_sdt=2005&sciodt=0,5&hl=en",152,"2021-05-11 13:03:30","PDF","","","",,,,,80,7.27,40,2,11,"The power consumption of ICT is still increasing. To date, it is not clear if the energy savings through ICT overbalance the energy consumption by ICT, or not. Where manifold efforts of Green IT address the environmental aspects of sustainability considering computer …"
53,"AAA Adenowo, BA Adenowo","Software Engineering Methodologies: A Review of the Waterfall Model and Object-Oriented Approach",2013,"… Journal of Scientific & Engineering …","researchgate.net","https://www.researchgate.net/profile/Adetokunbo_Adenowo/publication/344194737_Software_Engineering_Methodologies_A_Review_of_the_Waterfall_Model_and_Object-_Oriented_Approach/links/5f5a803292851c07895d2ce8/Software-Engineering-Methodologies-A-Review-of-the-Waterfall-Model-and-Object-Oriented-Approach.pdf","https://scholar.google.com/scholar?cites=9700703330416502103&as_sdt=2005&sciodt=0,5&hl=en",153,"2021-05-11 13:03:30","PDF","","","",,,,,53,6.63,27,2,8,"This paper discusses two main software engineering methodologies to system development, the waterfall model and the objectoriented approach. A review of literature reveals that waterfall model uses linear approach and is only suitable for sequential or procedural …"
56,"EM Choi","Applying inverted classroom to software engineering education",2013,"International Journal of e-Education, e …","pdfs.semanticscholar.org","https://pdfs.semanticscholar.org/0697/f5a724b85443c0e64ae50a3a56d2bd0513da.pdf","https://scholar.google.com/scholar?cites=15996249637937241570&as_sdt=2005&sciodt=0,5&hl=en",154,"2021-05-11 13:03:30","PDF","","","",,,,,56,7.00,56,1,8,"A successful engineering education must possess a wide engineering disciplines and real-world skills. Software engineers have ability to apply several methods in practice. Engineering educators face a complementary and more challenging problem, how to …"
46,"M Marchesi, L Marchesi, R Tonelli","An agile software engineering method to design blockchain applications",2018,"… European Software Engineering …","dl.acm.org","https://dl.acm.org/doi/abs/10.1145/3290621.3290627","https://scholar.google.com/scholar?cites=435137041082858935&as_sdt=2005&sciodt=0,5&hl=en",155,"2021-05-11 13:03:30","","","","",,,,,46,15.33,15,3,3,"Cryptocurrencies and their foundation technology, the Blockchain, are reshaping finance and economics, allowing a decentralized approach enabling trusted applications with no trusted counterpart. More recently, the Blockchain and the programs running on it, called …"
82,"N Amsel, Z Ibrahim, A Malik…","Toward sustainable software engineering: NIER track",2011,"… on software engineering …","ieeexplore.ieee.org","https://ieeexplore.ieee.org/abstract/document/6032566/","https://scholar.google.com/scholar?cites=13285296010653914563&as_sdt=2005&sciodt=0,5&hl=en",156,"2021-05-11 13:03:30","","","","",,,,,82,8.20,21,4,10,"Current software engineering practices have significant effects on the environment. Examples include e-waste from computers made obsolete due to software upgrades, and changes in the power demands of new versions of software. Sustainable software …"
