Cites,Authors,Title,Year,Source,Publisher,ArticleURL,CitesURL,GSRank,QueryDate,Type,DOI,ISSN,CitationURL,Volume,Issue,StartPage,EndPage,ECC,CitesPerYear,CitesPerAuthor,AuthorCount,Age,Abstract
10,"J de Fine Licht, T Hoefler","hlslib: Software engineering for hardware design",2019,"arXiv preprint arXiv:1910.04436","spcl.inf.ethz.ch","http://spcl.inf.ethz.ch/Publications/.pdf/hlslib.pdf","https://scholar.google.com/scholar?cites=12862110284987957666&as_sdt=2005&sciodt=2007&hl=en",80,"2021-04-19 20:05:26","PDF","","","",,,,,10,5.00,5,2,2,"High-level synthesis (HLS) tools have brought FPGA development into the mainstream, by allowing programmers to design architectures using familiar languages such as C, C++, and OpenCL. While the move to these languages has brought significant benefits, many aspects …"
36,"B Cartaxo, G Pinto, S Soares","The role of rapid reviews in supporting decision-making in software engineering practice",2018,"… and Assessment in Software Engineering …","dl.acm.org","https://dl.acm.org/doi/abs/10.1145/3210459.3210462","https://scholar.google.com/scholar?cites=12688921960307286429&as_sdt=2005&sciodt=2007&hl=en",81,"2021-04-19 20:05:26","","","","",,,,,36,12.00,12,3,3,"ABSTRACT Context: Recent work on Evidence Based Software Engineering (EBSE) suggests that systematic reviews lack connection with Software Engineering (SE) practice. In Evidence Based Medicine there is a growing initiative to address this kind of problem, in …"
25,"K Buffardi, C Robb, D Rahn","Tech startups: realistic software engineering projects with interdisciplinary collaboration",2017,"Journal of Computing Sciences in …","researchgate.net","https://www.researchgate.net/profile/Kevin_Buffardi/publication/316075237_TECH_STARTUPS_REALISTIC_SOFTWARE_ENGINEERING_PROJECTS_WITH_INTERDISCIPLINARY_COLLABORATION/links/58ef00ca458515c4aa52dc28/TECH-STARTUPS-REALISTIC-SOFTWARE-ENGINEERING-PROJECTS-WITH-INTERDISCIPLINARY-COLLABORATION.pdf","https://scholar.google.com/scholar?cites=8708168389468980911&as_sdt=2005&sciodt=2007&hl=en",82,"2021-04-19 20:05:26","PDF","","","",,,,,25,6.25,8,3,4,"Team projects in software engineering courses can contextualize practical software development experience and help students transition into related careers. However, the traditional academic environment is not particularly conducive to realistic software …"
41,"CY Laporte, M Munoz, JM Miranda…","Applying software engineering standards in very small entities: from startups to grownups",2017,"… software","ieeexplore.ieee.org","https://ieeexplore.ieee.org/abstract/document/8239934/","https://scholar.google.com/scholar?cites=15990739487647526699&as_sdt=2005&sciodt=2007&hl=en",83,"2021-04-19 20:05:26","","","","",,,,,41,10.25,10,4,4,"Very small entities (VSEs) are organizations with up to 25 people. The ISO/IEC 29110 series of standards and guides target VSEs with little or no experience or expertise in selecting the appropriate processes from lifecycle standards and tailoring them to a project's needs. This …"
189,"V Garousi, M Felderer, MV Mäntylä","Guidelines for including grey literature and conducting multivocal literature reviews in software engineering",2019,"Information and Software Technology","Elsevier","https://www.sciencedirect.com/science/article/pii/S0950584918301939","https://scholar.google.com/scholar?cites=14274678186042515684&as_sdt=2005&sciodt=2007&hl=en",84,"2021-04-19 20:05:26","","","","",,,,,189,94.50,63,3,2,"Abstract Context A Multivocal Literature Review (MLR) is a form of a Systematic Literature Review (SLR) which includes the grey literature (eg, blog posts, videos and white papers) in addition to the published (formal) literature (eg, journal and conference papers). MLRs are …"
32,"M Palacin-Silva, J Khakurel…","Infusing design thinking into a software engineering capstone course",2017,"… Engineering …","ieeexplore.ieee.org","https://ieeexplore.ieee.org/abstract/document/8166705/","https://scholar.google.com/scholar?cites=16636266091208168347&as_sdt=2005&sciodt=2007&hl=en",85,"2021-04-19 20:05:26","","","","",,,,,32,8.00,11,3,4,"Software engineering (SE) educators are challenged to balance the scope and depth in their courses to train students in skills which will fulfill the ever-evolving industry needs. Capstone courses are a tool for educators to transfer hands-on experience into practical knowledge …"
8,"EM Lavrischeva","The Scientific basis of software engineering",2018,"International Journal of Applied and Natural …","academia.edu","https://www.academia.edu/download/57325206/3._IJANS-THE_SCIENTIFIC_BASIS_OF_SOFTWARE_ENGINEERING_-_Copy.pdf","https://scholar.google.com/scholar?cites=3274951558289025562&as_sdt=2005&sciodt=2007&hl=en",86,"2021-04-19 20:05:26","PDF","","","",,,,,8,2.67,8,1,3,"Define the scientifical concepts and fundamental basis of Software Engineering (SE). The scientifically concepts are modules, objects, programs, systems and processes of design program systems. The fundamental basic of the SE are: assembly method of modules; …"
12,"M Kuutila, M Mäntylä, U Farooq, M Claes","Time pressure in software engineering: A systematic review",2020,"Information and Software …","Elsevier","https://www.sciencedirect.com/science/article/pii/S0950584920300045","https://scholar.google.com/scholar?cites=7142200196142302159&as_sdt=2005&sciodt=2007&hl=en",87,"2021-04-19 20:05:26","","","","",,,,,12,12.00,3,4,1,"Context Large project overruns and overtime work have been reported in the software industry, resulting in additional expense for companies and personal issues for developers. Experiments and case studies have investigated the relationship between time pressure and …"
19,"A AlSubaihin, F Sarro, S Black, L Capra…","App store effects on software engineering practices",2019,"… Software Engineering","ieeexplore.ieee.org","https://ieeexplore.ieee.org/abstract/document/8606261/","https://scholar.google.com/scholar?cites=5154753086191279443&as_sdt=2005&sciodt=2007&hl=en",88,"2021-04-19 20:05:26","","","","",,,,,19,9.50,4,5,2,"In this paper, we study the app store as a phenomenon from the developers perspective to investigate the extent to which app stores affect software engineering tasks. Through developer interviews and questionnaires, we uncover findings that highlight and quantify the …"
31,"R Mohanani, I Salman, B Turhan…","Cognitive biases in software engineering: a systematic mapping study",2018,"… Engineering","ieeexplore.ieee.org","https://ieeexplore.ieee.org/abstract/document/8506423/","https://scholar.google.com/scholar?cites=15296946934251526692&as_sdt=2005&sciodt=2007&hl=en",89,"2021-04-19 20:05:26","","","","",,,,,31,10.33,8,4,3,"One source of software project challenges and failures is the systematic errors introduced by human cognitive biases. Although extensively explored in cognitive psychology, investigations concerning cognitive biases have only recently gained popularity in software …"
19,"D Delgado, A Velasco, J Aponte…","Evolving a project-based software engineering course: A case study",2017,"… on Software Engineering …","ieeexplore.ieee.org","https://ieeexplore.ieee.org/abstract/document/8166686/","https://scholar.google.com/scholar?cites=12220125562737421431&as_sdt=2005&sciodt=2007&hl=en",90,"2021-04-19 20:05:26","","","","",,,,,19,4.75,5,4,4,"This paper presents the evolution of a project-based course in Software Engineering for undergraduate students at the Universidad Nacional de Colombia. We describe and explain the changes we have done over six semesters. In addition, we investigate the effects of the …"
50,"I Fronza, NE Ioini, L Corral","Teaching computational thinking using agile software engineering methods: A framework for middle schools",2017,"ACM Transactions on Computing Education …","dl.acm.org","https://dl.acm.org/doi/abs/10.1145/3055258","https://scholar.google.com/scholar?cites=858514501035124871&as_sdt=2005&sciodt=2007&hl=en",91,"2021-04-19 20:05:26","","","","",,,,,50,12.50,17,3,4,"Computational Thinking (CT) has been recognized as one of the fundamental skills that all graduates should acquire. For this reason, motivational concerns need to be addressed at an early age of a child, and reaching students who do not consider themselves candidates …"
32,"F Hermans, E Aivaloglou","Teaching software engineering principles to k-12 students: a mooc on scratch",2017,"… Engineering: Software Engineering …","ieeexplore.ieee.org","https://ieeexplore.ieee.org/abstract/document/7964325/","https://scholar.google.com/scholar?cites=2657409866817118336&as_sdt=2005&sciodt=2007&hl=en",92,"2021-04-19 20:05:26","","","","",,,,,32,8.00,16,2,4,"In the last few years, many books, online puzzles, apps and games have been created to teach young children programming. However, most of these do not introduce children to broader concepts from software engineering, such as debugging and code quality issues …"
18,"JF DeFranco, PA Laplante","A content analysis process for qualitative software engineering research",2017,"… in Systems and Software Engineering","Springer","https://link.springer.com/article/10.1007/s11334-017-0287-0","https://scholar.google.com/scholar?cites=379703049178653309&as_sdt=2005&sciodt=2007&hl=en",93,"2021-04-19 20:05:26","","","","",,,,,18,4.50,9,2,4,"A review of the qualitative research methods discussed in papers that study software engineering teams showed most of those papers did not follow a systematic process during the qualitative analysis. This finding is concerning as this deficiency in research analysis …"
62,"M Usman, R Britto, J Börstler, E Mendes","Taxonomies in software engineering: A systematic mapping study and a revised taxonomy development method",2017,"Information and Software …","Elsevier","https://www.sciencedirect.com/science/article/pii/S0950584917300472","https://scholar.google.com/scholar?cites=6408523524029074239&as_sdt=2005&sciodt=2007&hl=en",94,"2021-04-19 20:05:26","HTML","","","",,,,,62,15.50,16,4,4,"Abstract Context: Software Engineering (SE) is an evolving discipline with new subareas being continuously developed and added. To structure and better understand the SE body of knowledge, taxonomies have been proposed in all SE knowledge areas. Objective: The …"
21,"V Basili, L Briand, D Bianculli, S Nejati…","Software engineering research and industry: a symbiotic relationship to Foster impact",2018,"… Software","ieeexplore.ieee.org","https://ieeexplore.ieee.org/abstract/document/8409904/","https://scholar.google.com/scholar?cites=5761406160681252593&as_sdt=2005&sciodt=2007&hl=en",95,"2021-04-19 20:05:26","","","","",,,,,21,7.00,4,5,3,"Software engineering is not only an increasingly challenging endeavor that goes beyond the intellectual capabilities of any single individual engineer but also an intensely human one. Tools and methods to develop software are employed by engineers of varied backgrounds …"
13,"JS Molléri, K Petersen, E Mendes","Cerse-catalog for empirical research in software engineering: A systematic mapping study",2019,"Information and Software Technology","Elsevier","https://www.sciencedirect.com/science/article/pii/S0950584917301118","https://scholar.google.com/scholar?cites=12611094297240992715&as_sdt=2005&sciodt=2007&hl=en",96,"2021-04-19 20:05:26","","","","",,,,,13,6.50,4,3,2,"Context Empirical research in software engineering contributes towards developing scientific knowledge in this field, which in turn is relevant to inform decision-making in industry. A number of empirical studies have been carried out to date in software …"
28,"ML Fioravanti, B Sena, LN Paschoal, LR Silva…","Integrating project based learning and project management for software engineering teaching: An experience report",2018,"Proceedings of the 49th …","dl.acm.org","https://dl.acm.org/doi/abs/10.1145/3159450.3159599","https://scholar.google.com/scholar?cites=7448355311338999610&as_sdt=2005&sciodt=2007&hl=en",97,"2021-04-19 20:05:26","","","","",,,,,28,9.33,6,5,3,"Software Engineering (SE) is an important topic to be taught in Computer Science courses. However, teaching of theoretical concepts with no link to their practical applications or no examples in the student's context may discourage learning, justifying why teaching and …"
23,"D Bozhinoski, D Di Ruscio, I Malavolta…","Safety for mobile robotic systems: A systematic mapping study from a software engineering perspective",2019,"… of Systems and Software","Elsevier","https://www.sciencedirect.com/science/article/pii/S0164121219300317","https://scholar.google.com/scholar?cites=17275593728246131528&as_sdt=2005&sciodt=2007&hl=en",98,"2021-04-19 20:05:26","","","","",,,,,23,11.50,6,4,2,"Robotic research is making huge progress. However, existing solutions are facing a number of challenges preventing them from being used in our everyday tasks:(i) robots operate in unknown environments,(ii) robots collaborate with each other and even with humans, and …"
12,"N Novielli, A Serebrenik","Sentiment and emotion in software engineering",2019,"IEEE Software","ieeexplore.ieee.org","https://ieeexplore.ieee.org/abstract/document/8802324/","https://scholar.google.com/scholar?cites=8758355255005156766&as_sdt=2005&sciodt=2007&hl=en",99,"2021-04-19 20:05:26","","","","",,,,,12,6.00,6,2,2,"We are glad to present the"" Sentiment and Emotion in Software Engineering"" special issue of IEEE Software. In recent years, this topic has gained attention from both the research community and industry. Indeed, academic researchers have organized a number of highly …"
20,"A Martin, C Anslow, D Johnson","Teaching agile methods to software engineering professionals: 10 years, 1000 release plans",2017,"… Conference on Agile Software …","library.oapen.org","https://library.oapen.org/bitstream/handle/20.500.12657/27861/1002143.pdf?sequence=1#page=162","https://scholar.google.com/scholar?cites=18313570522367422594&as_sdt=2005&sciodt=2007&hl=en",100,"2021-04-19 20:05:26","PDF","","","",,,,,20,5.00,7,3,4,"Agile methods are an essential resource for software engineers. The Agile movement evolved out of industry and is the common approach to software development today. Teaching Agile methods challenges students' working attitudes, where putting Agile into …"
24,"G Matturro, F Raschetti, C Fontán","A Systematic Mapping Study on Soft Skills in Software Engineering.",2019,"J. UCS","jucs.org","http://www.jucs.org/jucs_25_1/a_systematic_mapping_study/jucs_25_01_0016_0041_matturo.pdf","https://scholar.google.com/scholar?cites=12446462847826216220&as_sdt=2005&sciodt=2007&hl=en",101,"2021-04-19 20:05:26","","","","",,,,,24,12.00,8,3,2,"To participate in software development projects, team members may need to perform different roles and be skilled in diverse methodologies, tools and techniques. However, other skills, usually known as “soft skills” are also necessary. We report the results of a …"
13,"JS Molléri, K Petersen, E Mendes","Cerse-catalog for empirical research in software engineering: A systematic mapping study",2019,"Information and Software Technology","Elsevier","https://www.sciencedirect.com/science/article/pii/S0950584917301118","https://scholar.google.com/scholar?cites=12611094297240992715&as_sdt=2005&sciodt=2007&hl=en",102,"2021-04-19 20:05:26","","","","",,,,,13,6.50,4,3,2,"Context Empirical research in software engineering contributes towards developing scientific knowledge in this field, which in turn is relevant to inform decision-making in industry. A number of empirical studies have been carried out to date in software …"
23,"D Bozhinoski, D Di Ruscio, I Malavolta…","Safety for mobile robotic systems: A systematic mapping study from a software engineering perspective",2019,"… of Systems and Software","Elsevier","https://www.sciencedirect.com/science/article/pii/S0164121219300317","https://scholar.google.com/scholar?cites=17275593728246131528&as_sdt=2005&sciodt=2007&hl=en",103,"2021-04-19 20:05:26","","","","",,,,,23,11.50,6,4,2,"Robotic research is making huge progress. However, existing solutions are facing a number of challenges preventing them from being used in our everyday tasks:(i) robots operate in unknown environments,(ii) robots collaborate with each other and even with humans, and …"
28,"ML Fioravanti, B Sena, LN Paschoal, LR Silva…","Integrating project based learning and project management for software engineering teaching: An experience report",2018,"Proceedings of the 49th …","dl.acm.org","https://dl.acm.org/doi/abs/10.1145/3159450.3159599","https://scholar.google.com/scholar?cites=7448355311338999610&as_sdt=2005&sciodt=2007&hl=en",104,"2021-04-19 20:05:26","","","","",,,,,28,9.33,6,5,3,"Software Engineering (SE) is an important topic to be taught in Computer Science courses. However, teaching of theoretical concepts with no link to their practical applications or no examples in the student's context may discourage learning, justifying why teaching and …"
64,"K Aggarwal, F Timbers, T Rutgers…","Detecting duplicate bug reports with software engineering domain knowledge",2017,"Journal of Software …","Wiley Online Library","https://onlinelibrary.wiley.com/doi/abs/10.1002/smr.1821","https://scholar.google.com/scholar?cites=2059744879584341042&as_sdt=2005&sciodt=2007&hl=en",105,"2021-04-19 20:05:26","","","","",,,,,64,16.00,16,4,4,"Bug deduplication, ie, recognizing bug reports that refer to the same problem, is a challenging task in the software‐engineering life cycle. Researchers have proposed several methods primarily relying on information‐retrieval techniques. Our work motivated by the …"
10,"I Sommerville","Engineering Software Products",2020,"","pearsonhighered.com","https://www.pearsonhighered.com/assets/preface/0/1/3/5/013521064X.pdf","https://scholar.google.com/scholar?cites=7985106236694579556&as_sdt=2005&sciodt=2007&hl=en",106,"2021-04-19 20:05:26","BOOK","","","",,,,,10,10.00,10,1,1,"Names: Sommerville, Ian, 1951–author. Title: Engineering software products/Ian Sommerville. Description: First edition.| Hoboken, NJ: Pearson, 2019.| Includes bibliographical references and indexes. Identifiers: LCCN 2019004631| ISBN …"
15,"G Ivanova, V Kozov, P Zlatarov","Gamification in software engineering education",2019,"2019 42nd International …","ieeexplore.ieee.org","https://ieeexplore.ieee.org/abstract/document/8757200/","https://scholar.google.com/scholar?cites=14059237938679524837&as_sdt=2005&sciodt=2007&hl=en",107,"2021-04-19 20:05:26","","","","",,,,,15,7.50,5,3,2,"Gamification has proven to be an adequate approach in various educational environments, from kindergarten and elementary school to higher education classrooms. While it has been extremely effective with school students and standard subjects, such as STEM, when …"
28,"C Mills, G Bavota, S Haiduc, R Oliveto…","Predicting query quality for applications of text retrieval to software engineering tasks",2017,"… Software Engineering …","dl.acm.org","https://dl.acm.org/doi/abs/10.1145/3078841","https://scholar.google.com/scholar?cites=11049128842174702112&as_sdt=2005&sciodt=2007&hl=en",108,"2021-04-19 20:05:26","","","","",,,,,28,7.00,6,5,4,"Context: Since the mid-2000s, numerous recommendation systems based on text retrieval (TR) have been proposed to support software engineering (SE) tasks such as concept location, traceability link recovery, code reuse, impact analysis, and so on. The success of …"
10,"L Burgueño, F Ciccozzi, M Famelis, G Kappel…","Contents for a model-based software engineering body of knowledge",2019,"Software and systems …","Springer","https://link.springer.com/article/10.1007/s10270-019-00746-9","https://scholar.google.com/scholar?cites=271334595476022265&as_sdt=2005&sciodt=2007&hl=en",109,"2021-04-19 20:05:26","HTML","","","",,,,,10,5.00,2,5,2,"Abstract Although Model-Based Software Engineering (MBE) is a widely accepted Software Engineering (SE) discipline, no agreed-upon core set of concepts and practices (ie, a Body of Knowledge) has been defined for it yet. With the goals of characterizing the contents of the …"
27,"A Ramirez, JR Romero, S Ventura","A survey of many-objective optimisation in search-based software engineering",2019,"Journal of Systems and Software","Elsevier","https://www.sciencedirect.com/science/article/pii/S0164121218302759","https://scholar.google.com/scholar?cites=15739830394459946803&as_sdt=2005&sciodt=2007&hl=en",110,"2021-04-19 20:05:26","","","","",,,,,27,13.50,9,3,2,"Search-based software engineering (SBSE) is changing the way traditional software engineering (SE) activities are carried out by reformulating them as optimisation problems. The natural evolution of SBSE is bringing new challenges, such as the need of a large …"
12,"S Al-Fedaghi","Toward maximum grip process modeling in software engineering",2019,"Available at SSRN 3412000","papers.ssrn.com","https://papers.ssrn.com/sol3/papers.cfm?abstract_id=3412000","https://scholar.google.com/scholar?cites=13753073824397399012&as_sdt=2005&sciodt=2007&hl=en",111,"2021-04-19 20:05:26","","","","",,,,,12,6.00,12,1,2,"Process modeling (PM) in software engineering involves a specific way of understanding the world. In this context, philosophical work is not merely intrinsically important; it can also stand up to some of the more established software engineering research metrics. The object …"
3,"C Watson","Deep Learning in Software Engineering",2020,"","scholarworks.wm.edu","https://scholarworks.wm.edu/etd/1616444371/","https://scholar.google.com/scholar?cites=2549192825038577993&as_sdt=2005&sciodt=2007&hl=en",112,"2021-04-19 20:05:26","","","","",,,,,3,3.00,3,1,1,"Software evolves and therefore requires an evolving field of Software Engineering. The evolution of software can be seen on an individual project level through the software life cycle, as well as on a collective level, as we study the trends and uses of software in the real …"
7,"E Suescún Monsalve, M Toro, R Mazo…","SimulES-W: A collaborative game to improve software engineering teaching",2018,"Computación y …","scielo.org.mx","http://www.scielo.org.mx/scielo.php?pid=S1405-55462018000300953&script=sci_arttext&tlng=en","https://scholar.google.com/scholar?cites=7082113619892127742&as_sdt=2005&sciodt=2007&hl=en",113,"2021-04-19 20:05:26","HTML","","","",,,,,7,2.33,2,4,3,"There is empirical evidence concerning the effectiveness and benefits of game-based learning (GBL). Our mainly interest is to present a tool that can be used to complement teaching software engineering in a motivating and didactic way. This paper studies the use …"
58,"BR Barricelli, F Cassano, D Fogli, A Piccinno","End-user development, end-user programming and end-user software engineering: A systematic mapping study",2019,"… of Systems and Software","Elsevier","https://www.sciencedirect.com/science/article/pii/S0164121218302577","https://scholar.google.com/scholar?cites=8146773584402524084&as_sdt=2005&sciodt=2007&hl=en",114,"2021-04-19 20:05:26","","","","",,,,,58,29.00,15,4,2,"Abstract End-User Development (EUD), End-Programming (EUP) and End-User Software Engineering (EUSE) are three related research fields that study methods and techniques for empowering end users to modify and create digital artifacts. This paper presents a …"
10,"E Mourão, JF Pimentel, L Murta, M Kalinowski…","On the performance of hybrid search strategies for systematic literature reviews in software engineering",2020,"… and Software …","Elsevier","https://www.sciencedirect.com/science/article/pii/S0950584920300446","https://scholar.google.com/scholar?cites=9034030950086365551&as_sdt=2005&sciodt=2007&hl=en",115,"2021-04-19 20:05:26","","","","",,,,,10,10.00,2,5,1,"Abstract Context When conducting a Systematic Literature Review (SLR), researchers usually face the challenge of designing a search strategy that appropriately balances result quality and review effort. Using digital library (or database) searches or snowballing alone …"
6,"M Piattini, G Peterssen, R Pérez-Castillo","Quantum Computing: A New Software Engineering Golden Age",2020,"… Software Engineering Notes","dl.acm.org","https://dl.acm.org/doi/abs/10.1145/3402127.3402131","https://scholar.google.com/scholar?cites=13363069798924100664&as_sdt=2005&sciodt=2007&hl=en",116,"2021-04-19 20:05:26","","","","",,,,,6,6.00,2,3,1,"Quantum computing, and to an even greater extent quantum technology, is changing the world. Quantum computing is not an evolution of classical computer science; it is actually a revolution that completely changes the computing paradigm. Quantum computers are based …"
18,"A Marowka","On parallel software engineering education using python",2018,"Education and Information Technologies","Springer","https://link.springer.com/article/10.1007/s10639-017-9607-0","https://scholar.google.com/scholar?cites=1391476876464307100&as_sdt=2005&sciodt=2007&hl=en",117,"2021-04-19 20:05:26","","","","",,,,,18,6.00,18,1,3,"Python is gaining popularity in academia as the preferred language to teach novices serial programming. The syntax of Python is clean, easy, and simple to understand. At the same time, it is a high-level programming language that supports multi programming paradigms …"
21,"J Al-Jaroodi, B Hollein…","Applying software engineering processes for big data analytics applications development",2017,"2017 IEEE 7th Annual …","ieeexplore.ieee.org","https://ieeexplore.ieee.org/abstract/document/7868456/","https://scholar.google.com/scholar?cites=10956425332931679920&as_sdt=2005&sciodt=2007&hl=en",118,"2021-04-19 20:05:26","","","","",,,,,21,5.25,7,3,4,"Developing large scale software projects involves huge efforts at every stage of the software development life cycle (SDLC). This led researchers and practitioners to develop software processes and methodologies that will assist software developers and improve their …"
