Cites,Authors,Title,Year,Source,Publisher,ArticleURL,CitesURL,GSRank,QueryDate,Type,DOI,ISSN,CitationURL,Volume,Issue,StartPage,EndPage,ECC,CitesPerYear,CitesPerAuthor,AuthorCount,Age,Abstract
11,"M Staron","Action Research in Software Engineering",2020,"","Springer","https://link.springer.com/content/pdf/10.1007/978-3-030-32610-4.pdf","https://scholar.google.com/scholar?cites=16000204140790615546&as_sdt=2005&sciodt=2007&hl=en",41,"2021-04-19 20:05:26","BOOK","","","",,,,,11,11.00,11,1,1,"Every scientist has his and her own favorite research topics, types of studies, and research methodology. It's natural, and it's something that is very important for all kinds of researchers. I see it as a part of academic freedom. For me, the favorite research methodology is action …"
30,"AN Ghazi, K Petersen, SSVR Reddy, H Nekkanti","Survey research in software engineering: Problems and mitigation strategies",2018,"IEEE Access","ieeexplore.ieee.org","https://ieeexplore.ieee.org/abstract/document/8533319/","https://scholar.google.com/scholar?cites=15235629582378186719&as_sdt=2005&sciodt=2007&hl=en",42,"2021-04-19 20:05:26","","","","",,,,,30,10.00,8,4,3,"Background: The need for empirical investigations in software engineering is growing. Many researchers nowadays, conduct and validate their solutions using empirical research. The Survey is an empirical method which enables researchers to collect data from a large …"
25,"E Winter, S Forshaw, MA Ferrario","Measuring human values in software engineering",2018,"… on Empirical Software Engineering …","dl.acm.org","https://dl.acm.org/doi/abs/10.1145/3239235.3267427","https://scholar.google.com/scholar?cites=5475093738650344194&as_sdt=2005&sciodt=2007&hl=en",43,"2021-04-19 20:05:26","","","","",,,,,25,8.33,8,3,3,"Background: Human values, such as prestige, social justice, and financial success, influence software production decision-making processes. While their subjectivity makes some values difficult to measure, their impact on software motivates our research. Aim: To …"
36,"V Garousi, G Giray, E Tuzun, C Catal…","Closing the gap between software engineering education and industrial needs",2019,"IEEE Software","ieeexplore.ieee.org","https://ieeexplore.ieee.org/abstract/document/8664487/","https://scholar.google.com/scholar?cites=1106036066154396192&as_sdt=2005&sciodt=2007&hl=en",44,"2021-04-19 20:05:26","","","","",,,,,36,18.00,7,5,2,"Many recent software engineering graduates often face difficulties when beginning their professional careers, due to misalignment of the skills learned in their university education with what is needed in industry. In this article, we report a literature review of the studies that …"
39,"N Alshahwan, X Gao, M Harman, Y Jia, K Mao…","Deploying search based software engineering with Sapienz at Facebook",2018,"… Software Engineering","Springer","https://link.springer.com/chapter/10.1007/978-3-319-99241-9_1","https://scholar.google.com/scholar?cites=6513715295229843952&as_sdt=2005&sciodt=2007&hl=en",45,"2021-04-19 20:05:26","HTML","","","",,,,,39,13.00,7,6,3,"We describe the deployment of the Sapienz Search Based Software Engineering (SBSE) testing system. Sapienz has been deployed in production at Facebook since September 2017 to design test cases, localise and triage crashes to developers and to monitor their …"
19,"Y Yang, D Falessi, T Menzies, J Hihn","Actionable analytics for software engineering",2017,"IEEE Software","ieeexplore.ieee.org","https://ieeexplore.ieee.org/abstract/document/8239931/","https://scholar.google.com/scholar?cites=10869265580869900738&as_sdt=2005&sciodt=2007&hl=en",46,"2021-04-19 20:05:26","","","","",,,,,19,4.75,5,4,4,"Although intensive research on software analytics has been going on for nearly a decade, a repeated complaint in software analytics is that industrial practitioners find it hard to apply the results generated from data science. This theme issue aims to reflect on actionable …"
72,"RA Maurício, L Veado, RT Moreira, E Figueiredo…","A systematic mapping study on game-related methods for software engineering education",2018,"Information and software …","Elsevier","https://www.sciencedirect.com/science/article/pii/S0950584917303518","https://scholar.google.com/scholar?cites=1857286907707008172&as_sdt=2005&sciodt=2007&hl=en",47,"2021-04-19 20:05:26","","","","",,,,,72,24.00,14,5,3,"Context The use of games in software engineering education is not new. However, recent technologies have provided new opportunities for using games and their elements to enhance learning and student engagement. Objective The goal of this paper is twofold. First …"
27,"A García-Holgado, FJ García-Peñalvo…","Pilot experience applying an active learning methodology in a Software Engineering classroom",2018,"… Global Engineering …","ieeexplore.ieee.org","https://ieeexplore.ieee.org/abstract/document/8363331/","https://scholar.google.com/scholar?cites=7934284923787735941&as_sdt=2005&sciodt=2007&hl=en",48,"2021-04-19 20:05:26","","","","",,,,,27,9.00,9,3,3,"Software Engineering I is a mandatory subject for undergraduate students that is taught in the second semester of the 2nd year of the Degree in Computer Sciences at the University of Salamanca (Spain). This degree exists since 1989 but it has transformed over time …"
16,"VS Sharma, R Mehra, V Kaulgud…","An immersive future for software engineering: Avenues and approaches",2018,"… on Software Engineering …","dl.acm.org","https://dl.acm.org/doi/abs/10.1145/3183399.3183414","https://scholar.google.com/scholar?cites=17139618889921429453&as_sdt=2005&sciodt=2007&hl=en",49,"2021-04-19 20:05:26","","","","",,,,,16,5.33,4,4,3,"Software systems are increasingly becoming more intricate and complex, necessitating new ways to be able to comprehend and visualize them. At the same time, the nature of software engineering teams itself is changing with people playing more fluid roles often needing …"
11,"N Wolfram, P Lago, F Osborne","Sustainability in software engineering",2017,"2017 Sustainable Internet and …","ieeexplore.ieee.org","https://ieeexplore.ieee.org/abstract/document/8379798/","https://scholar.google.com/scholar?cites=18246896674635715265&as_sdt=2005&sciodt=2007&hl=en",50,"2021-04-19 20:05:26","","","","",,,,,11,2.75,4,3,4,"The intersection between software engineering research and the problems related to sustainability and green IT has been the subject of increasing attention. In spite of that, we observe that sustainability is still not clearly defined, or understood, in the field of software …"
22,"KJ Stol, TD LaToza, C Bird","Crowdsourcing for software engineering",2017,"IEEE software","ieeexplore.ieee.org","https://ieeexplore.ieee.org/abstract/document/7888402/","https://scholar.google.com/scholar?cites=13137932449304529336&as_sdt=2005&sciodt=2007&hl=en",51,"2021-04-19 20:05:26","","","","",,,,,22,5.50,7,3,4,"Crowdsourcing, which leverages the intelligence and contributions of a large group of people to achieve a specific goal, is disrupting business models and work practices. Because crowdsourcing approaches could have a far-reaching impact on future software …"
56,"B Morin, N Harrand, F Fleurey","Model-based software engineering to tame the IoT jungle",2017,"IEEE Software","ieeexplore.ieee.org","https://ieeexplore.ieee.org/abstract/document/7819419/","https://scholar.google.com/scholar?cites=10777678349383608046&as_sdt=2005&sciodt=2007&hl=en",52,"2021-04-19 20:05:26","","","","",,,,,56,14.00,19,3,4,"The Internet of Things (IoT) is a challenging combination of distribution and heterogeneity. A number of software engineering solutions address those challenges in isolation, but few solutions tackle them in combination, which poses a set of concrete challenges. The …"
82,"R De Lemos, D Garlan, C Ghezzi, H Giese…","Software engineering for self-adaptive systems: Research challenges in the provision of assurances",2017,"Software Engineering for …","Springer","https://link.springer.com/chapter/10.1007/978-3-319-74183-3_1","https://scholar.google.com/scholar?cites=2017351717377071557&as_sdt=2005&sciodt=2007&hl=en",53,"2021-04-19 20:05:26","","","","",,,,,82,20.50,16,5,4,"The important concern for modern software systems is to become more cost-effective, while being versatile, flexible, resilient, dependable, energy-efficient, customisable, configurable and self-optimising when reacting to run-time changes that may occur within the system …"
30,"A Ramirez, JR Romero…","A systematic review of interaction in search-based software engineering",2018,"… on Software Engineering","ieeexplore.ieee.org","https://ieeexplore.ieee.org/abstract/document/8283568/","https://scholar.google.com/scholar?cites=7181557104732349243&as_sdt=2005&sciodt=2007&hl=en",54,"2021-04-19 20:05:26","","","","",,,,,30,10.00,10,3,3,"Search-Based Software Engineering (SBSE) has been successfully applied to automate a wide range of software development activities. Nevertheless, in those software engineering problems where human evaluation and preference are crucial, such insights have proved …"
13,"B Cartaxo, G Pinto, S Soares","Towards a model to transfer knowledge from software engineering research to practice",2018,"Information and software technology","Elsevier","https://www.sciencedirect.com/science/article/pii/S0950584918300028","https://scholar.google.com/scholar?cites=16102025367082429533&as_sdt=2005&sciodt=2007&hl=en",55,"2021-04-19 20:05:26","","","","",,,,,13,4.33,4,3,3,"Context: Many researchers argue that Software Engineering (SE) research lacks connection with practice. Objective: We propose a model aimed at supporting researchers to transfer knowledge to SE practice. Method: This model is built upon the foundation of Rapid Reviews …"
9,"X Chen, C Chen, D Zhang…","Sethesaurus: Wordnet in software engineering",2019,"… on Software Engineering","ieeexplore.ieee.org","https://ieeexplore.ieee.org/abstract/document/8827962/","https://scholar.google.com/scholar?cites=17951526562780165815&as_sdt=2005&sciodt=2007&hl=en",56,"2021-04-19 20:05:26","","","","",,,,,9,4.50,2,4,2,"Informal discussions on social platforms (eg, Stack Overflow, CodeProject) have accumulated a large body of programming knowledge in the form of natural language text. Natural language process (NLP) techniques can be utilized to harvest this knowledge base …"
21,"R Feldt, T Zimmermann, GR Bergersen…","Four commentaries on the use of students and professionals in empirical software engineering experiments",2018,"… Software Engineering","Springer","https://link.springer.com/article/10.1007/s10664-018-9655-0","https://scholar.google.com/scholar?cites=3263910080428625520&as_sdt=2005&sciodt=2007&hl=en",57,"2021-04-19 20:05:26","HTML","","","",,,,,21,7.00,5,4,3,"During my PhD studies in the late 1990's, I conducted experiments on software inspections. The overall goal was to estimate the remaining defect content after an inspection. We launched a quasi-experiment with students and professionals to get data for the estimation …"
110,"A Agrawal, W Fu, T Menzies","What is wrong with topic modeling? And how to fix it using search-based software engineering",2018,"Information and Software Technology","Elsevier","https://www.sciencedirect.com/science/article/pii/S0950584917300861","https://scholar.google.com/scholar?cites=3874567981649946814&as_sdt=2005&sciodt=2007&hl=en",58,"2021-04-19 20:05:26","","","","",,,,,110,36.67,37,3,3,"Context Topic modeling finds human-readable structures in unstructured textual data. A widely used topic modeling technique is Latent Dirichlet allocation. When running on different datasets, LDA suffers from “order effects”, ie, different topics are generated if the …"
5,"S Al-Fedaghi","Modeling events and events of events in software engineering",2020,"arXiv preprint arXiv:2001.11962","arxiv.org","https://arxiv.org/abs/2001.11962","https://scholar.google.com/scholar?cites=1471944638917151149&as_sdt=2005&sciodt=2007&hl=en",59,"2021-04-19 20:05:26","","","","",,,,,5,5.00,5,1,1,"A model is a simplified representation of portion of reality that hides a system s nonessential characteristics. It provides a means for reducing complexity as well as visualization and communication and a basis for building it. Most models involve graphic languages during …"
28,"E Klotins, M Unterkalmsteiner…","A progression model of software engineering goals, challenges, and practices in start-ups",2019,"… Engineering","ieeexplore.ieee.org","https://ieeexplore.ieee.org/abstract/document/8643804/","https://scholar.google.com/scholar?cites=9981322177734304579&as_sdt=2005&sciodt=2007&hl=en",60,"2021-04-19 20:05:26","","","","",,,,,28,14.00,9,3,2,"Context: Software start-ups are emerging as suppliers of innovation and software-intensive products. However, traditional software engineering practices are not evaluated in the context, nor adopted to goals and challenges of start-ups. As a result, there is insufficient …"
12,"E Mendes, C Wohlin, K Felizardo…","When to update systematic literature reviews in software engineering",2020,"… of Systems and Software","Elsevier","https://www.sciencedirect.com/science/article/pii/S0164121220300856","https://scholar.google.com/scholar?cites=14871430036722041709&as_sdt=2005&sciodt=2007&hl=en",61,"2021-04-19 20:05:26","","","","",,,,,12,12.00,3,4,1,"Abstract [Context] Systematic Literature Reviews (SLRs) have been adopted by the Software Engineering (SE) community for approximately 15 years to provide meaningful summaries of evidence on several topics. Many of these SLRs are now potentially outdated, and there are …"
13,"B Cartaxo, G Pinto, S Soares","Towards a model to transfer knowledge from software engineering research to practice",2018,"Information and software technology","Elsevier","https://www.sciencedirect.com/science/article/pii/S0950584918300028","https://scholar.google.com/scholar?cites=16102025367082429533&as_sdt=2005&sciodt=2007&hl=en",62,"2021-04-19 20:05:26","","","","",,,,,13,4.33,4,3,3,"Context: Many researchers argue that Software Engineering (SE) research lacks connection with practice. Objective: We propose a model aimed at supporting researchers to transfer knowledge to SE practice. Method: This model is built upon the foundation of Rapid Reviews …"
9,"X Chen, C Chen, D Zhang…","Sethesaurus: Wordnet in software engineering",2019,"… on Software Engineering","ieeexplore.ieee.org","https://ieeexplore.ieee.org/abstract/document/8827962/","https://scholar.google.com/scholar?cites=17951526562780165815&as_sdt=2005&sciodt=2007&hl=en",63,"2021-04-19 20:05:26","","","","",,,,,9,4.50,2,4,2,"Informal discussions on social platforms (eg, Stack Overflow, CodeProject) have accumulated a large body of programming knowledge in the form of natural language text. Natural language process (NLP) techniques can be utilized to harvest this knowledge base …"
110,"A Agrawal, W Fu, T Menzies","What is wrong with topic modeling? And how to fix it using search-based software engineering",2018,"Information and Software Technology","Elsevier","https://www.sciencedirect.com/science/article/pii/S0950584917300861","https://scholar.google.com/scholar?cites=3874567981649946814&as_sdt=2005&sciodt=2007&hl=en",64,"2021-04-19 20:05:26","","","","",,,,,110,36.67,37,3,3,"Context Topic modeling finds human-readable structures in unstructured textual data. A widely used topic modeling technique is Latent Dirichlet allocation. When running on different datasets, LDA suffers from “order effects”, ie, different topics are generated if the …"
21,"R Feldt, T Zimmermann, GR Bergersen…","Four commentaries on the use of students and professionals in empirical software engineering experiments",2018,"… Software Engineering","Springer","https://link.springer.com/article/10.1007/s10664-018-9655-0","https://scholar.google.com/scholar?cites=3263910080428625520&as_sdt=2005&sciodt=2007&hl=en",65,"2021-04-19 20:05:26","HTML","","","",,,,,21,7.00,5,4,3,"During my PhD studies in the late 1990's, I conducted experiments on software inspections. The overall goal was to estimate the remaining defect content after an inspection. We launched a quasi-experiment with students and professionals to get data for the estimation …"
5,"S Al-Fedaghi","Modeling events and events of events in software engineering",2020,"arXiv preprint arXiv:2001.11962","arxiv.org","https://arxiv.org/abs/2001.11962","https://scholar.google.com/scholar?cites=1471944638917151149&as_sdt=2005&sciodt=2007&hl=en",66,"2021-04-19 20:05:26","","","","",,,,,5,5.00,5,1,1,"A model is a simplified representation of portion of reality that hides a system s nonessential characteristics. It provides a means for reducing complexity as well as visualization and communication and a basis for building it. Most models involve graphic languages during …"
28,"E Klotins, M Unterkalmsteiner…","A progression model of software engineering goals, challenges, and practices in start-ups",2019,"… Engineering","ieeexplore.ieee.org","https://ieeexplore.ieee.org/abstract/document/8643804/","https://scholar.google.com/scholar?cites=9981322177734304579&as_sdt=2005&sciodt=2007&hl=en",67,"2021-04-19 20:05:26","","","","",,,,,28,14.00,9,3,2,"Context: Software start-ups are emerging as suppliers of innovation and software-intensive products. However, traditional software engineering practices are not evaluated in the context, nor adopted to goals and challenges of start-ups. As a result, there is insufficient …"
15,"M Sánchez-Gordón, R Colomo-Palacios","Taking the emotional pulse of software engineering—A systematic literature review of empirical studies",2019,"Information and Software …","Elsevier","https://www.sciencedirect.com/science/article/pii/S0950584919301661","https://scholar.google.com/scholar?cites=16573381393043962526&as_sdt=2005&sciodt=2007&hl=en",68,"2021-04-19 20:05:26","","","","",,,,,15,7.50,8,2,2,"Context Over the past 50 years of Software Engineering, numerous studies have acknowledged the importance of human factors. However, software developers' emotions are still an area under investigation and debate that is gaining relevance in the software …"
20,"M Shepperd, N Ajienka, S Counsell","The role and value of replication in empirical software engineering results",2018,"Information and Software Technology","Elsevier","https://www.sciencedirect.com/science/article/pii/S0950584917304305","https://scholar.google.com/scholar?cites=18094137266049313273&as_sdt=2005&sciodt=2007&hl=en",69,"2021-04-19 20:05:26","","","","",,,,,20,6.67,7,3,3,"Context Concerns have been raised from many quarters regarding the reliability of empirical research findings and this includes software engineering. Replication has been proposed as an important means of increasing confidence. Objective We aim to better understand the …"
36,"DM Berry","Evaluation of tools for hairy requirements and software engineering tasks",2017,"… IEEE 25th International Requirements Engineering …","ieeexplore.ieee.org","https://ieeexplore.ieee.org/abstract/document/8054866/","https://scholar.google.com/scholar?cites=8141492420367410177&as_sdt=2005&sciodt=2007&hl=en",70,"2021-04-19 20:05:26","","","","",,,,,36,9.00,36,1,4,"Context and Motivation A hairy requirements or software engineering task involving natural language (NL) documents is one that is not inherently difficult for NL-understanding humans on a small scale but becomes unmanageable in the large scale. A hairy task demands tool …"
11,"RA Buchmann, M Cinpoeru, A Harkai…","Model-Aware Software Engineering",2018,"… Software Engineering","scitepress.org","https://www.scitepress.org/papers/2018/66941/66941.pdf","https://scholar.google.com/scholar?cites=13449238509751881178&as_sdt=2005&sciodt=2007&hl=en",71,"2021-04-19 20:05:26","PDF","","","",,,,,11,3.67,3,4,3,"Standard modelling languages enabled the Model-Driven Software Engineering paradigm, allowing the development of model compilers for code generation. This, however, induces a subordination of implementation to the modelling language: the modelling benefits are …"
27,"S Semerikov, A Striuk, L Striuk, M Striuk, H Shalatska","Sustainability in Software Engineering Education: a case of general professional competencies",2020,"","ds.knu.edu.ua","http://ds.knu.edu.ua/jspui/handle/123456789/2285","https://scholar.google.com/scholar?cites=8683284042989128699&as_sdt=2005&sciodt=2007&hl=en",72,"2021-04-19 20:05:26","","","","",,,,,27,27.00,5,5,1,"The article considers the application of the sustainable development concept to software engineering specialists training. A system of general professional competencies is designed to build sustainable professional competence of software engineering specialist: 1) ability for …"
18,"F Gurcan, C Kose","Analysis of software engineering industry needs and trends: Implications for education",2017,"International Journal of Engineering Education","researchgate.net","https://www.researchgate.net/profile/Fatih_Gurcan/publication/318582283_Analysis_of_software_engineering_industry_needs_and_trends_Implications_for_education/links/5c52fbc0a6fdccd6b5d74b7d/Analysis-of-software-engineering-industry-needs-and-trends-Implications-for-education.pdf","https://scholar.google.com/scholar?cites=9274074904045957721&as_sdt=2005&sciodt=2007&hl=en",73,"2021-04-19 20:05:26","PDF","","","",,,,,18,4.50,9,2,4,"In modern day software development environments, analysis and understanding of the emerging industry needs is of strategic importance for a more effective software engineering (SE) education that is innovative and responsive to changing industry needs. Considering …"
35,"X Zhou, X Peng, T Xie, J Sun, C Xu…","Poster: Benchmarking microservice systems for software engineering research",2018,"… Software Engineering …","ieeexplore.ieee.org","https://ieeexplore.ieee.org/abstract/document/8449560/","https://scholar.google.com/scholar?cites=9442943006492489386&as_sdt=2005&sciodt=2007&hl=en",74,"2021-04-19 20:05:26","","","","",,,,,35,11.67,6,6,3,"Despite the prevalence and importance of microservices in industry, there exists limited research on microservices, partly due to lacking a benchmark system that reflects the characteristics of industrial microservice systems. To fill this gap, we conduct a review of …"
26,"NH Adnan, AD Ritzhaupt","Software engineering design principles applied to instructional design: What can we learn from our sister discipline?",2018,"TechTrends","Springer","https://link.springer.com/article/10.1007/s11528-017-0238-5","https://scholar.google.com/scholar?cites=14287646002352698518&as_sdt=2005&sciodt=2007&hl=en",75,"2021-04-19 20:05:26","","","","",,,,,26,8.67,13,2,3,"The failure of many instructional design initiatives is often attributed to poor instructional design. Current instructional design models do not provide much insight into design processes for creating e-learning instructional solutions. Given the similarities between the …"
16,"V Garousi, G Giray, E Tüzün, C Catal…","Aligning software engineering education with industrial needs: a meta-analysis",2019,"… of Systems and Software","Elsevier","https://www.sciencedirect.com/science/article/pii/S0164121219301347","https://scholar.google.com/scholar?cites=16689224409945456342&as_sdt=2005&sciodt=2007&hl=en",76,"2021-04-19 20:05:26","","","","",,,,,16,8.00,3,5,2,"Context According to various reports, many software engineering (SE) graduates often face difficulties when beginning their careers, which is mainly due to misalignment of the skills learned in university education with what is needed in the software industry. Objective Our …"
33,"S Gerasimou, R Calinescu, G Tamburrelli","Synthesis of probabilistic models for quality-of-service software engineering",2018,"… Software Engineering","Springer","https://link.springer.com/article/10.1007/s10515-018-0235-8","https://scholar.google.com/scholar?cites=2276036135933120987&as_sdt=2005&sciodt=2007&hl=en",77,"2021-04-19 20:05:26","HTML","","","",,,,,33,11.00,11,3,3,"An increasingly used method for the engineering of software systems with strict quality-of-service (QoS) requirements involves the synthesis and verification of probabilistic models for many alternative architectures and instantiations of system parameters. Using manual trial …"
36,"A Haghighatkhah, A Banijamali, OP Pakanen…","Automotive software engineering: A systematic mapping study",2017,"… of Systems and Software","Elsevier","https://www.sciencedirect.com/science/article/pii/S0164121217300560","https://scholar.google.com/scholar?cites=1333064628705138919&as_sdt=2005&sciodt=2007&hl=en",78,"2021-04-19 20:05:26","","","","",,,,,36,9.00,9,4,4,"The automotive industry is going through a fundamental change by moving from a mechanical to a software-intensive industry in which most innovation and competition rely on software engineering competence. Over the last few decades, the importance of software …"
15,"Y Dajsuren, M van den Brand","Automotive Systems and Software Engineering",2019,"","Springer","https://link.springer.com/content/pdf/10.1007/978-3-030-12157-0.pdf","https://scholar.google.com/scholar?cites=17121068043653287815&as_sdt=2005&sciodt=2007&hl=en",79,"2021-04-19 20:05:26","BOOK","","","",,,,,15,7.50,8,2,2,"Software is “conquering” the world. There is hardly any piece of equipment that does not have software in it. This is certainly true for the automotive domain. The amount of software has grown from a few lines of code in the 1970s to millions of lines of code in modern cars …"
